,abstract,date,headline,id,paragraph,text,type
349,,2011-12-26,Faceless,504a78581c22dfde670bcb01,"Dori Frame has a neurological disorder called prosopagnosia. She cannot recognize human faces, and even close friends and relatives can look unfamiliar to her.","Faceless Dori Frame has a neurological disorder called prosopagnosia. She cannot recognize human faces, and even close friends and relatives can look unfamiliar to her.  ",Video
350,,2011-12-07,Presidential Aging Doesn’t Cut Life Short,5403f0687988105a0bd3f87f,"Even when a study calculated presidential life expectancy by subtracting two days of life for every day in office, it found that presidents who died of natural causes lived longer than predicted.","Presidential Aging Doesn’t Cut Life Short Even when a study calculated presidential life expectancy by subtracting two days of life for every day in office, it found that presidents who died of natural causes lived longer than predicted.  ",Interactive Feature
351,,2011-11-25,Meaning in Madness,504a77ce1c22dfde670bc6a1,"Milton Greek, who has been diagnosed with schizophrenia, believes that decoding the messages in delusions can help some people recover.","Meaning in Madness Milton Greek, who has been diagnosed with schizophrenia, believes that decoding the messages in delusions can help some people recover.  ",Video
352,,2011-11-22,The Long Haul,54036c807988105a0bd3f46e,"Between sitting all day, eating fast food and sleeping poorly, truckers have major challenges when it comes to staying healthy. Here, five truckers speak about what they are doing to try to drop few pounds and get fit.","The Long Haul Between sitting all day, eating fast food and sleeping poorly, truckers have major challenges when it comes to staying healthy. Here, five truckers speak about what they are doing to try to drop few pounds and get fit.  ",Interactive Feature
353,,2011-11-01,Well’s Vegetarian Thanksgiving 2011,5333faf979881069601eac7e,"Are you ready to reimagine Thanksgiving without the turkey? All month, we present delicious no-meat recipes for your holiday table from some of your favorite chefs and cookbook authors.","Well’s Vegetarian Thanksgiving 2011 Are you ready to reimagine Thanksgiving without the turkey? All month, we present delicious no-meat recipes for your holiday table from some of your favorite chefs and cookbook authors.  ",Interactive Feature
354,,2011-10-22,Finding a Life That Fits,504a772f1c22dfde670bc1c0,"Keris Myrick, who has been diagnosed with schizoaffective disorder and obsessive compulsive disorder, finds ways to manage her illness.","Finding a Life That Fits Keris Myrick, who has been diagnosed with schizoaffective disorder and obsessive compulsive disorder, finds ways to manage her illness.  ",Video
355,,2011-10-06,Modifying an Old Technique,5401ca6779881068a1948bfc,Researchers have developed a method to more reliably produce human embryonic stem cells.,Modifying an Old Technique Researchers have developed a method to more reliably produce human embryonic stem cells.  ,Interactive Feature
356,,2011-09-27,A Simple Solution to Prevent Cervical Cancer,52be4899798810447146acce,"With vinegar and a little training, great strides are being taken in preventing cervical cancer globally.","A Simple Solution to Prevent Cervical Cancer With vinegar and a little training, great strides are being taken in preventing cervical cancer globally.  ",Slideshow
357,,2011-09-27,The Group Treatment for AIDS,52be48c9798810447146acd0,Patient groups share the burdens of living with AIDS.,The Group Treatment for AIDS Patient groups share the burdens of living with AIDS.  ,Slideshow
358,,2011-09-26,Small Fixes: Paper Diagnostics,504a76dc1c22dfde670bbf6a,"Donald G. McNeil Jr., a science reporter for The New York Times, explains a liver damage test that fits on a postage stamp and could cost less than a penny.","Small Fixes: Paper Diagnostics Donald G. McNeil Jr., a science reporter for The New York Times, explains a liver damage test that fits on a postage stamp and could cost less than a penny.  ",Video
359,,2011-08-29,Handing Over the Keys,5237639e79881007d5917d58,Patients find end-of-road care in RVs.,Handing Over the Keys Patients find end-of-road care in RVs.  ,Video
360,,2011-08-29,"My House, Our Home",523763a579881007d5917d62,"Seniors share a home and find companionship, caregiving and financial security.","My House, Our Home Seniors share a home and find companionship, caregiving and financial security.  ",Video
361,,2011-08-22,Creating a Community,504a78201c22dfde670bc8d0,A group of seniors came together to build a community for their old age.,Creating a Community A group of seniors came together to build a community for their old age.  ,Video
362,,2011-08-15,Takes a Village,504a78201c22dfde670bc8aa,"Senior residents of Lincoln Park, Chicago, find a way to age at home.","Takes a Village Senior residents of Lincoln Park, Chicago, find a way to age at home.  ",Video
363,,2011-08-08,"My House, Our Home",504a78201c22dfde670bc87e,"For some, having a live-in house guest who can also help is the perfect solution for aging at home.","My House, Our Home For some, having a live-in house guest who can also help is the perfect solution for aging at home.  ",Video
364,,2011-07-26,Men Who Grieve Together,5410b26d79881060c5af8549,Five men speak about mourning the loss of their wives and how grieving with other men has helped.,Men Who Grieve Together Five men speak about mourning the loss of their wives and how grieving with other men has helped.  ,Interactive Feature
365,,2011-07-18,Swimming With the Sharks,52be086c798810447146a9ca,"At age 61, Diana Nyad will attempt to be the only woman to swim from Cuba to Key West, Fla., without a shark cage.","Swimming With the Sharks At age 61, Diana Nyad will attempt to be the only woman to swim from Cuba to Key West, Fla., without a shark cage.  ",Slideshow
366,,2011-06-28,History of a Virus,540f29ae79881013877495cc,"Rinderpest, a relative of measles that kills cattle, emerged more than 1,000 years ago, probably on the Central Asian steppes. After 300 years of human efforts, it is now the second virus, after smallpox, to be eradicated.","History of a Virus Rinderpest, a relative of measles that kills cattle, emerged more than 1,000 years ago, probably on the Central Asian steppes. After 300 years of human efforts, it is now the second virus, after smallpox, to be eradicated.  ",Interactive Feature
367,,2011-06-27,TimesCast | A Disease Eradicated,504a784b1c22dfde670bca61,"June 27, 2011 - The United Nations will soon declare Rinderpest the second disease ever to be eradicated.","TimesCast | A Disease Eradicated June 27, 2011 - The United Nations will soon declare Rinderpest the second disease ever to be eradicated.  ",Video
368,,2011-06-23,The Power of Rescuing Others,504a784b1c22dfde670bca94,"Marsha Linehan, a therapist and researcher at the University of Washington who suffered from borderline personality disorder, recalls the religious experience that transformed her as a young woman.","The Power of Rescuing Others Marsha Linehan, a therapist and researcher at the University of Washington who suffered from borderline personality disorder, recalls the religious experience that transformed her as a young woman.  ",Video
369,,2011-05-24,Gym Class: Samurai Sword Workout,504a77ac1c22dfde670bc508,"The Times's fitness guinea pig, Karen Barrow, tries a samurai sword workout.","Gym Class: Samurai Sword Workout The Times's fitness guinea pig, Karen Barrow, tries a samurai sword workout.  ",Video
370,,2011-05-17,3D Angiogram,504a77ac1c22dfde670bc555,A 3D CT Angiogram,3D Angiogram A 3D CT Angiogram  ,Video
371,,2011-05-16,Donating Lives,504a77ac1c22dfde670bc558,Julio Garcia died unexpectedly in 2010. His widow decided to donate his organs to seven different people. And they recently had the opportunity to thank her in person.,Donating Lives Julio Garcia died unexpectedly in 2010. His widow decided to donate his organs to seven different people. And they recently had the opportunity to thank her in person.  ,Video
372,,2011-05-16,Love Endures Even Cancer,504a77ac1c22dfde670bc507,Gavin Snow found out he had stage 3 melanoma two months before meeting Haley Tanner. Together they have endured the ups and downs of living with a tragic disease.,Love Endures Even Cancer Gavin Snow found out he had stage 3 melanoma two months before meeting Haley Tanner. Together they have endured the ups and downs of living with a tragic disease.  ,Video
373,,2011-04-25,Gym Class: Antigravity Yoga,504a776a1c22dfde670bc30c,"The Times's fitness guinea pig, Karen Barrow, reviews a gravity-defying form of yoga.","Gym Class: Antigravity Yoga The Times's fitness guinea pig, Karen Barrow, reviews a gravity-defying form of yoga.  ",Video
374,,2011-04-25,Annoying: The Science of What Bugs Us,504a776b1c22dfde670bc386,"There's nowhere to hide and no one is immune. Can science explain life's annoyances? NPR's Joe Palca and Flora Lichtman investigate in Annoying: The Science of What Bugs Us (Wiley, 2011).","Annoying: The Science of What Bugs Us There's nowhere to hide and no one is immune. Can science explain life's annoyances? NPR's Joe Palca and Flora Lichtman investigate in Annoying: The Science of What Bugs Us (Wiley, 2011).  ",Video
375,,2011-04-23,A Profession in Transition,540d0f097988100d2d57e9a7,"American medicine is steadily shifting away from small, privately owned clinics and becoming an industry dominated by larger groups of doctors in salaried jobs.","A Profession in Transition American medicine is steadily shifting away from small, privately owned clinics and becoming an industry dominated by larger groups of doctors in salaried jobs.  ",Interactive Feature
376,,2011-03-31,Patient Voices: Charcot-Marie-Tooth Disease,5342cbc77988106f3076e400,"A genetic disease that causes weakness in the hands, arms, feet and legs, C.M.T. can cause difficulty walking and performing tasks.","Patient Voices: Charcot-Marie-Tooth Disease A genetic disease that causes weakness in the hands, arms, feet and legs, C.M.T. can cause difficulty walking and performing tasks.  ",Interactive Feature
377,,2011-03-30,Strut Your Stuff,523269c679881007d591763c,"In this sequence, the first bird runs across a rough surface. The second bird runs across a slick surface successfully, but the third bird runs across the same slick surface and slips and falls.","Strut Your Stuff In this sequence, the first bird runs across a rough surface. The second bird runs across a slick surface successfully, but the third bird runs across the same slick surface and slips and falls.  ",Video
378,,2011-03-27,Battling Over Childrens’ Diets,527154a979881060c2e47373,"A campaign against childhood obesity is up against an array of powerful forces, from economics to biology, all of which are playing out in Philadelphia.","Battling Over Childrens’ Diets A campaign against childhood obesity is up against an array of powerful forces, from economics to biology, all of which are playing out in Philadelphia.  ",Slideshow
379,,2011-03-05,Radiation Overdoses Despite F.D.A. Warnings,540b71e07988105a10ca82b0,"Problems with radiation overdoses during CT brain perfusion scans became apparent in 2009, leading to an investigation by the Food and Drug Administration. Despite repeated warnings by the F.D.A., patients at Cabell Huntington Hospital in West Virginia continued to received elevated levels of radiation.","Radiation Overdoses Despite F.D.A. Warnings Problems with radiation overdoses during CT brain perfusion scans became apparent in 2009, leading to an investigation by the Food and Drug Administration. Despite repeated warnings by the F.D.A., patients at Cabell Huntington Hospital in West Virginia continued to received elevated levels of radiation.  ",Interactive Feature
380,,2011-02-28,A Doctor's E-Mails About Over-Radiated Babies,540b39a67988105a10ca7ed9,"In July 2007, Dr. Salvatore Sclafani emailed colleagues at SUNY Downstate Medical Center in Brooklyn, New York, about his discovery that premature babies had been over-radiated.","A Doctor's E-Mails About Over-Radiated Babies In July 2007, Dr. Salvatore Sclafani emailed colleagues at SUNY Downstate Medical Center in Brooklyn, New York, about his discovery that premature babies had been over-radiated.  ",Interactive Feature
381,,2010-12-31,"For Alzheimer’s Patients, Focusing on Comfort",504a8ca41c22dfde670c45da,"In a strategy that disregards typical nursing-home rules, the Beatitudes nursing home in Phoenix allows patients practically anything that brings comfort.","For Alzheimer’s Patients, Focusing on Comfort In a strategy that disregards typical nursing-home rules, the Beatitudes nursing home in Phoenix allows patients practically anything that brings comfort.  ",Slideshow
382,,2010-11-22,When Trauma Lingers,504a76b91c22dfde670bbeb3,Post-traumatic stress disorder doesn't only affect war veterans. It may also affect that young girl walking her dog down the street.,When Trauma Lingers Post-traumatic stress disorder doesn't only affect war veterans. It may also affect that young girl walking her dog down the street.  ,Video
383,,2010-11-21,Dentists Embrace New Device,5420e60e7988104c4a501bb4,The cone beam CT scanner’s popularity has grown in part from misinformation about its safety and efficacy.,Dentists Embrace New Device The cone beam CT scanner’s popularity has grown in part from misinformation about its safety and efficacy.  ,Interactive Feature
384,,2010-11-08,Well’s Vegetarian Thanksgiving 2010,542ecdf57988105c45302fa4,Delicious no-meat recipes for your holiday table from some of your favorite chefs and cookbook authors.,Well’s Vegetarian Thanksgiving 2010 Delicious no-meat recipes for your holiday table from some of your favorite chefs and cookbook authors.  ,Interactive Feature
385,,2010-11-06,A Lifetime With H.I.V.,54205f787988104c4a500fd6,What is it like to be born with H.I.V.? How does it affect your outlook? Four young adults speak about their lives.,A Lifetime With H.I.V. What is it like to be born with H.I.V.? How does it affect your outlook? Four young adults speak about their lives.  ,Interactive Feature
386,,2010-10-19,Secrets of the Centenarians,541bca8a7988100a1c6604f2,"What is it like to live till 100? Eight men and women, aged 99 to 103, speak about their century of life.","Secrets of the Centenarians What is it like to live till 100? Eight men and women, aged 99 to 103, speak about their century of life.  ",Interactive Feature
387,,2010-08-24,Dr. Harvey Cushing’s Patients,504a8c191c22dfde670c41d1,"Dr. Harvey Cushing, one of America’s first neurosurgeons, kept extensive samples from his practice, but many of the details have been lost. Here is a sample of his body of work.","Dr. Harvey Cushing’s Patients Dr. Harvey Cushing, one of America’s first neurosurgeons, kept extensive samples from his practice, but many of the details have been lost. Here is a sample of his body of work.  ",Slideshow
388,,2010-08-01,The Mark of an Overdose,540b71e07988105a10ca82af,Voices of patients who received radiation overdoses from a procedure called a CT brain perfusion scan.,The Mark of an Overdose Voices of patients who received radiation overdoses from a procedure called a CT brain perfusion scan.  ,Interactive Feature
389,,2010-07-19,Pathology of Errors,504a753b1c22dfde670bb38e,"As pathologists help doctors diagnose breast cancer at an earlier, more survivable stage, the potential for mistakes has grown. ","Pathology of Errors As pathologists help doctors diagnose breast cancer at an earlier, more survivable stage, the potential for mistakes has grown.   ",Video
390,,2010-06-02,Patient Voices: Alzheimer's Disease,5277fa947988102a7fb27dad,"A slow decline in memory, an inability to complete simple tasks, the concern about long-term care - eight men and women speak about living with and caring for someone with Alzheimer's disease.","Patient Voices: Alzheimer's Disease A slow decline in memory, an inability to complete simple tasks, the concern about long-term care - eight men and women speak about living with and caring for someone with Alzheimer's disease.  ",Interactive Feature
391,,2010-06-01,Fear Grips a Family,504a75d91c22dfde670bb7ea,"A look at the world's largest family suffering from Alzheimer's disease, and the hope that they may help scientists find answers for everyone else.","Fear Grips a Family A look at the world's largest family suffering from Alzheimer's disease, and the hope that they may help scientists find answers for everyone else.  ",Video
392,,2010-05-13,Patient Voices: Thyroid Disease,5277fa917988102a7fb27da4,A tiny gland that can cause a host of problems. Six men and women speak about living with thyroid disease.,Patient Voices: Thyroid Disease A tiny gland that can cause a host of problems. Six men and women speak about living with thyroid disease.  ,Interactive Feature
393,,2010-05-03,Medical Students and Health Costs,504a76581c22dfde670bbafc,"Medical students are starting to learn about the cost of treatments, the financing of health care, and the impact of high medical bills on their patients.","Medical Students and Health Costs Medical students are starting to learn about the cost of treatments, the financing of health care, and the impact of high medical bills on their patients.  ",Video
394,,2010-04-08,Picture Your Life After Cancer,51782ab8fdc5920bc4000bcf,A collage of photos and insights submitted by readers.,Picture Your Life After Cancer A collage of photos and insights submitted by readers.  ,Interactive Feature
395,,2010-03-31,Bicycling With Parkinson's,504a756e1c22dfde670bb506,Video 1 shows a 58-year-old man with a 10-year history of idiopathic Parkinson's disease and an incapacitating freezing of gait. Video 2 shows his continued ability to ride a bicycle.  (Credit: The New England Journal of Medicine),Bicycling With Parkinson's Video 1 shows a 58-year-old man with a 10-year history of idiopathic Parkinson's disease and an incapacitating freezing of gait. Video 2 shows his continued ability to ride a bicycle.  (Credit: The New England Journal of Medicine)  ,Video
396,,2010-02-21,"A Patient, a Pioneer",504a76a11c22dfde670bbd9e,"After surgeries and chemotherapies failed, the last hope for Sam Spero, a cancer patient, is an experimental drug with high promise. The first in a series.","A Patient, a Pioneer After surgeries and chemotherapies failed, the last hope for Sam Spero, a cancer patient, is an experimental drug with high promise. The first in a series.  ",Video
397,,2010-01-26,Radiation Safety Falls Behind,504a76131c22dfde670bb92a,"As medical radiation technology advances, a patchwork of regulations does not always protect patients from radiation injury.","Radiation Safety Falls Behind As medical radiation technology advances, a patchwork of regulations does not always protect patients from radiation injury.  ",Video
398,,2009-12-18,Abington Memorial Hospital Commercial,504a75391c22dfde670bb325,"In this commercial, a child faces his mother's cancer.","Abington Memorial Hospital Commercial In this commercial, a child faces his mother's cancer.  ",Video
399,,2009-12-01,A New Beginning,504a75391c22dfde670bb2f7,"A video on Ronnye Manuelito's struggles to receive brain surgery, created by his sister, Brenda Manuelito, and Carmella Rodriguez of NDigiDreams, a company that teaches digital storytelling, and Mr. Manuelito.","A New Beginning A video on Ronnye Manuelito's struggles to receive brain surgery, created by his sister, Brenda Manuelito, and Carmella Rodriguez of NDigiDreams, a company that teaches digital storytelling, and Mr. Manuelito.  ",Video
400,,2009-10-11,The Struggle of Early Arrivals,504a8b041c22dfde670c37d6,"While fertility treatments create thousands of new families a year, multiple births carry special risks often overlooked in the desire to produce babies.","The Struggle of Early Arrivals While fertility treatments create thousands of new families a year, multiple births carry special risks often overlooked in the desire to produce babies.  ",Slideshow
401,,2009-10-04,Barefoot Running,504a73e21c22dfde670ba771,"The Roving Runner strides along Central Park barefoot with Christopher McDougall, author of the best-selling book “Born to Run.” To read more and to comment on this video go to the Well Blog.","Barefoot Running The Roving Runner strides along Central Park barefoot with Christopher McDougall, author of the best-selling book “Born to Run.” To read more and to comment on this video go to the Well Blog.  ",Video
402,,2009-10-03,Tainted Meat,504a73e41c22dfde670ba826,"Stephanie Smith’s reaction to a strain of E. coli was extreme, but neither the system meant to make meat safe, nor the meat itself, is what consumers have been led to believe.","Tainted Meat Stephanie Smith’s reaction to a strain of E. coli was extreme, but neither the system meant to make meat safe, nor the meat itself, is what consumers have been led to believe.  ",Video
403,,2009-09-10,Patient Voices,50be797600315214fbb7d7fe,"What is it like to live with a chronic disease, mental illness or confusing condition? In Patient Voices, we feature first person accounts of the challenges patients face as they cope with various health issues.","Patient Voices What is it like to live with a chronic disease, mental illness or confusing condition? In Patient Voices, we feature first person accounts of the challenges patients face as they cope with various health issues.  ",Interactive Feature
404,,2009-09-01,Swine Flu Precautions,504a741f1c22dfde670ba93d,NBC's Brian Williams reports on preparations across the nation for the expected resurgence of swine flu in the fall.,Swine Flu Precautions NBC's Brian Williams reports on preparations across the nation for the expected resurgence of swine flu in the fall.  ,Video
405,,2009-09-01,Patient Voices: Narcolepsy,5342cd807988106f3076e416,Six men and women discuss the realities of living with a sleep disorder.,Patient Voices: Narcolepsy Six men and women discuss the realities of living with a sleep disorder.  ,Interactive Feature
406,,2009-08-11,Dogs and Owners: A Family Resemblance,504a8a321c22dfde670c30ca,,Dogs and Owners: A Family Resemblance    ,Slideshow
407,,2009-08-07,Patient Voices: Type 2 Diabetes,5342c1bd7988107fc3649f91,"Over 20 million Americans are living with Type 2 diabetes. Here, six men and women speak about their experiences of living with diabetes.","Patient Voices: Type 2 Diabetes Over 20 million Americans are living with Type 2 diabetes. Here, six men and women speak about their experiences of living with diabetes.  ",Interactive Feature
408,,2009-06-30,Eating on the Run: Deena Kastor,504a74f21c22dfde670bb062,"The elite marathoner Deena Kastor and Mark Bittman, a food columnist at The New York Times, talk about food and running.","Eating on the Run: Deena Kastor The elite marathoner Deena Kastor and Mark Bittman, a food columnist at The New York Times, talk about food and running.  ",Video
409,,2009-06-20,Bad Seeds at the V.A.,504a74fd1c22dfde670bb1ab,"The Rev. Ricardo Flippin and other veterans received substandard prostate cancer treatments at the veterans' hospital in Philadelphia, where federal officials failed to detect a pattern of poor care.","Bad Seeds at the V.A. The Rev. Ricardo Flippin and other veterans received substandard prostate cancer treatments at the veterans' hospital in Philadelphia, where federal officials failed to detect a pattern of poor care.  ",Video
410,,2009-05-27,Running Voices,540b3bf67988105a10ca7efb,"A celebrity, a journalist and a ""big loser"" — three more runners tell their tales. ","Running Voices A celebrity, a journalist and a ""big loser"" — three more runners tell their tales.   ",Interactive Feature
411,,2009-05-24,Awake Craniotomy,504a74941c22dfde670badce,"Brain surgery performed at Methodist University Hospital in Memphis, Tenn., with the patient awake and talking to doctors. In this clip, doctors probe the patient's brain to get a functional map.","Awake Craniotomy Brain surgery performed at Methodist University Hospital in Memphis, Tenn., with the patient awake and talking to doctors. In this clip, doctors probe the patient's brain to get a functional map.  ",Video
412,,2009-05-18,Swine Flu Outbreak Stirs Fears,504a74861c22dfde670baca9,Schools have closed down from Queens to western Japan. New York Times science reporter Donald G. McNeil Jr. explains the facts behind the pandemic.,Swine Flu Outbreak Stirs Fears Schools have closed down from Queens to western Japan. New York Times science reporter Donald G. McNeil Jr. explains the facts behind the pandemic.  ,Video
413,,2009-04-29,Dealing With Swine Flu,504a745d1c22dfde670babf8,"Experts say countries should focus on mitigating the effects of swine flu, not closing borders or creating travel restrictions, because the virus cannot be contained. ","Dealing With Swine Flu Experts say countries should focus on mitigating the effects of swine flu, not closing borders or creating travel restrictions, because the virus cannot be contained.   ",Video
414,,2009-04-28,Living With Asthma,504a745d1c22dfde670babf2,"While doctors do not know why asthma rates are higher in cities, they can treat the disease using medication and allergy shots. ","Living With Asthma While doctors do not know why asthma rates are higher in cities, they can treat the disease using medication and allergy shots.   ",Video
415,,2009-04-05,State of the Economy Affects the State of Mind,546955707988101de50ec932,"As the economy worsens, people around the country have been reporting anxiety, depression and stress-related symptoms.","State of the Economy Affects the State of Mind As the economy worsens, people around the country have been reporting anxiety, depression and stress-related symptoms.  ",Interactive Feature
