,abstract,date,doctype,headline,id,news_desk,paragraph,section,subsection,text,type
503,,2015-08-08,article,Wastewater From Colorado Mine Reaches New Mexico,55c586387988104f5eefc320,None,"Mustard-colored wastewater laced with heavy metals continues to drain into a river from an abandoned mine in southwestern Colorado at a rate of about 550 gallons per minute, according to the Environmental Protection Agency, which caused the spill.",U.S.,,"Wastewater From Colorado Mine Reaches New Mexico Mustard-colored wastewater laced with heavy metals continues to drain into a river from an abandoned mine in southwestern Colorado at a rate of about 550 gallons per minute, according to the Environmental Protection Agency, which caused the spill.  ",News
504,,2015-08-07,article,"After Trump and Bush's Stumbles, Will Fiorina Ride to the Rescue?",55c523b87988104f5eefc258,None,Donald Trump&#8217;s caustic confrontation with Fox News Channel presenter Megyn Kelly at Thursday&#8217;s Republican presidential debate couldn&#8217;t have come at a less opportune time for a party trying to increase its appeal to women voters.,U.S.,Politics,"After Trump and Bush's Stumbles, Will Fiorina Ride to the Rescue? Donald Trump&#8217;s caustic confrontation with Fox News Channel presenter Megyn Kelly at Thursday&#8217;s Republican presidential debate couldn&#8217;t have come at a less opportune time for a party trying to increase its appeal to women voters.  ",News
505,,2015-08-04,article,Toxic Algae Blooming in Warm Water From California to Alaska,55c137c579881053589a0865,None,"A vast bloom of toxic algae off the West Coast is denser, more widespread and deeper than scientists feared even weeks ago, according to surveyors aboard a National Oceanic and Atmospheric Administration research vessel.",U.S.,,"Toxic Algae Blooming in Warm Water From California to Alaska A vast bloom of toxic algae off the West Coast is denser, more widespread and deeper than scientists feared even weeks ago, according to surveyors aboard a National Oceanic and Atmospheric Administration research vessel.  ",News
506,,2015-08-03,article,IOC Ready to Act if Olympic Medals Affected by Doping,55bf07497988102ce5b0cfd0,None,"The IOC will take action against any Olympic athletes if they are found guilty of the latest doping allegations rocking the sport of track and field, IOC President Thomas Bach said Monday.",Sports,Olympics,"IOC Ready to Act if Olympic Medals Affected by Doping The IOC will take action against any Olympic athletes if they are found guilty of the latest doping allegations rocking the sport of track and field, IOC President Thomas Bach said Monday.  ",News
507,,2015-07-31,article,Your Friday Evening Briefing,55bbf36e79881012a690ae45,NYTNow,Our nightly rundown will get you caught up on the day’s big stories.,NYT Now,,Your Friday Evening Briefing Our nightly rundown will get you caught up on the day’s big stories.  ,News
508,,2015-07-30,article,Early Retirement: Players Call It Quits in Prime of Careers,55b9c9c2798810561813c339,None,Patrick Willis walked away first with a nagging toe injury that kept him from being the dominant All-Pro linebacker of his prime.,Sports,Pro Football,Early Retirement: Players Call It Quits in Prime of Careers Patrick Willis walked away first with a nagging toe injury that kept him from being the dominant All-Pro linebacker of his prime.  ,News
509,,2015-08-11,article,Correction: Bernie Sanders-California Story,55c983247988100fc7f12c94,None,"In a story Aug. 10-11 about Democratic presidential candidate Bernie Sanders, The Associated Press reported erroneously that members of the activist group Black Lives Matter opened his campaign rally in Los Angeles. It was a member of Sanders' campaign who spoke in support of the group.",U.S.,,"Correction: Bernie Sanders-California Story In a story Aug. 10-11 about Democratic presidential candidate Bernie Sanders, The Associated Press reported erroneously that members of the activist group Black Lives Matter opened his campaign rally in Los Angeles. It was a member of Sanders' campaign who spoke in support of the group.  ",News
510,"Seven candidates who failed to make cut for main Republican presidential debate on Fox News spar in separate debate hours earlier; forum takes place on same stage as marquee event, though to smaller crowd; many questions focus on Iranian nuclear deal and abortion.",2015-08-07,article,"Before Main Republican Debate, Bottom 7 Contenders Put On Brave Faces",55c3ebd5798810228c90e184,National,"The seven Republican presidential candidates bumped from Thursday’s main event sparred several hours earlier, with little energy, in an empty arena.",U.S.,Politics,"Before Main Republican Debate, Bottom 7 Contenders Put On Brave Faces The seven Republican presidential candidates bumped from Thursday’s main event sparred several hours earlier, with little energy, in an empty arena. Seven candidates who failed to make cut for main Republican presidential debate on Fox News spar in separate debate hours earlier; forum takes place on same stage as marquee event, though to smaller crowd; many questions focus on Iranian nuclear deal and abortion.",News
511,Nicholas Kristof Op-Ed column expresses amazement that conservative Republicans in Congress are trying to end Title X program; initiative has been successful in reducing number of abortions and unwanted pregnancies as well as preventing spread of sexually transmitted disease.,2015-08-02,article,Our Sex-Crazed Congress,55bd15bd7988102a810a4c37,Editorial,House Republicans want to kill a family planning program that prevents abortions and saves lives.,Opinion,Sunday Review,Our Sex-Crazed Congress House Republicans want to kill a family planning program that prevents abortions and saves lives. Nicholas Kristof Op-Ed column expresses amazement that conservative Republicans in Congress are trying to end Title X program; initiative has been successful in reducing number of abortions and unwanted pregnancies as well as preventing spread of sexually transmitted disease.,Op-Ed
512,"Philip Galanes Social Q's on anti-Semitic comments, angry neighbors, unvaccinated children and airplane boarding.",2015-08-02,article,Even a Near Slur Demands an Apology,55ba662679881073c9554bb6,Styles,Plus: a dividing survey issue; vaccines and a new baby; and flight boarding by group.,Fashion & Style,,"Even a Near Slur Demands an Apology Plus: a dividing survey issue; vaccines and a new baby; and flight boarding by group. Philip Galanes Social Q's on anti-Semitic comments, angry neighbors, unvaccinated children and airplane boarding.",News
513,,2015-07-29,article,"Colorado Movie Gunman's Mother Weeps, Blames Mental Illness",55b9063b798810561813c136,None,"The mother of Colorado's movie rampage gunman wept on Wednesday as she said a university psychiatrist never told her James Holmes had homicidal thoughts before the massacre, and that she would have ""crawled on all fours"" to stop him had she known.",Arts,,"Colorado Movie Gunman's Mother Weeps, Blames Mental Illness The mother of Colorado's movie rampage gunman wept on Wednesday as she said a university psychiatrist never told her James Holmes had homicidal thoughts before the massacre, and that she would have ""crawled on all fours"" to stop him had she known.  ",News
514,,2015-08-09,article,China's Much-Hyped Healthcare Reform Drive Stuck in First Gear,55c7c2807988107a9cc5c5f3,None,"Li Tiantian, a Chinese doctor turned tech entrepreneur, is a leading light of the country's much-trumpeted healthcare reform drive. His medical networking platform DXY.com links two million doctors across China and has attracted funding from tech giants like Tencent.",World,Asia Pacific,"China's Much-Hyped Healthcare Reform Drive Stuck in First Gear Li Tiantian, a Chinese doctor turned tech entrepreneur, is a leading light of the country's much-trumpeted healthcare reform drive. His medical networking platform DXY.com links two million doctors across China and has attracted funding from tech giants like Tencent.  ",News
515,,2015-08-05,article,Will Your Boss Match Netflix's Yearlong Paid Leave?,55c26a567988107e31ff17de,None,"Netflix stirred envy in sleep-deprived parents nationwide by saying it will give its employees up to a year of paid leave following the birth or adoption of a child. But outside of hypercompetitive Silicon Valley, don't hold your breath for your boss to match it.",U.S.,,"Will Your Boss Match Netflix's Yearlong Paid Leave? Netflix stirred envy in sleep-deprived parents nationwide by saying it will give its employees up to a year of paid leave following the birth or adoption of a child. But outside of hypercompetitive Silicon Valley, don't hold your breath for your boss to match it.  ",News
516,,2015-08-08,article,"Chileans Cheer, Lament Death of Pinochet's Hated Police Boss",55c5fae37988104f5eefc3aa,None,"Manuel Contreras, who led Chile's now-defunct and much feared secret police force for several years under Augusto Pinochet, has died at the age of 86, provoking mixed reactions in a country still dealing with the dictatorship's legacy.",World,Americas,"Chileans Cheer, Lament Death of Pinochet's Hated Police Boss Manuel Contreras, who led Chile's now-defunct and much feared secret police force for several years under Augusto Pinochet, has died at the age of 86, provoking mixed reactions in a country still dealing with the dictatorship's legacy.  ",News
517,,2015-07-31,article,"Louganis Contemplates His, Fellow Olympian Jenner's Journeys",55baf54679881073c9554d77,None,Greg Louganis said he was unaware of fellow Olympian Bruce Jenner's gender identity struggle when their paths crossed at the Summer 1976 Games and in later years.,Arts,,"Louganis Contemplates His, Fellow Olympian Jenner's Journeys Greg Louganis said he was unaware of fellow Olympian Bruce Jenner's gender identity struggle when their paths crossed at the Summer 1976 Games and in later years.  ",News
518,,2015-07-30,article,Maryland Governor Orders Baltimore's Scandal-Plagued Jail Shut,55ba3546798810561813c473,None,"Baltimore's scandal-plagued jail will be shut down immediately, Maryland Governor Larry Hogan said on Thursday, calling the pre-Civil War site and its gang-related corruption ""a disgrace.""",U.S.,,"Maryland Governor Orders Baltimore's Scandal-Plagued Jail Shut Baltimore's scandal-plagued jail will be shut down immediately, Maryland Governor Larry Hogan said on Thursday, calling the pre-Civil War site and its gang-related corruption ""a disgrace.""  ",News
519,,2015-07-30,article,Clarkson and 'Top Gear' Presenters Sign With Amazon for New Car Show,55ba1171798810561813c40b,None,"Britain's former BBC ""Top Gear"" host Jeremy Clarkson has signed an exclusive deal with Amazon to present a new motoring show for the online retailer's subscription service alongside co-presenters Richard Hammond and James May.",Arts,,"Clarkson and 'Top Gear' Presenters Sign With Amazon for New Car Show Britain's former BBC ""Top Gear"" host Jeremy Clarkson has signed an exclusive deal with Amazon to present a new motoring show for the online retailer's subscription service alongside co-presenters Richard Hammond and James May.  ",News
520,,2015-08-10,article,Vermont Killing Highlights Dangers of Social Work,55c917ae7988100fc7f12bac,None,Police say a social worker in Vermont was killed by a mother upset that she had lost custody of her 9-year-old daughter. The killing of Lara Sobel is the latest in a roster of violent acts directed at social workers. Here's a look at some key facts about violence aimed at social workers:,U.S.,,Vermont Killing Highlights Dangers of Social Work Police say a social worker in Vermont was killed by a mother upset that she had lost custody of her 9-year-old daughter. The killing of Lara Sobel is the latest in a roster of violent acts directed at social workers. Here's a look at some key facts about violence aimed at social workers:  ,News
521,,2015-08-05,article,"Congress Breaks for August, Leaving a Bulky Must-Do List",55c285e27988107e31ff1847,None,"The House has left town for its August recess and the Senate is departing, which leaves a hefty list of unfinished business. Lawmakers have just 10 legislative days in September to ensure that the government stays open.",U.S.,Politics,"Congress Breaks for August, Leaving a Bulky Must-Do List The House has left town for its August recess and the Senate is departing, which leaves a hefty list of unfinished business. Lawmakers have just 10 legislative days in September to ensure that the government stays open.  ",News
522,,2015-08-04,article,SoftBank to Help Provide Financing to Rein in Sprint's Cash Burn,55c1212979881053589a07f9,None,"SoftBank Group Corp, the majority owner of Sprint Corp, said on Tuesday it will set up two financing vehicles to help the struggling U.S. wireless carrier reverse its fortunes, but a long road to recovery lies ahead.",Technology,,"SoftBank to Help Provide Financing to Rein in Sprint's Cash Burn SoftBank Group Corp, the majority owner of Sprint Corp, said on Tuesday it will set up two financing vehicles to help the struggling U.S. wireless carrier reverse its fortunes, but a long road to recovery lies ahead.  ",News
523,,2015-07-31,article,Missing Father of Golfer Billy Hurley Found Safe in Texas,55bbc79c79881012a690adaf,None,"The father of PGA Tour player Billy Hurley III was found safe in Texas after he went missing for nearly two weeks, police said Friday.",Sports,Golf,"Missing Father of Golfer Billy Hurley Found Safe in Texas The father of PGA Tour player Billy Hurley III was found safe in Texas after he went missing for nearly two weeks, police said Friday.  ",News
524,,2015-07-31,article,"Malaysia Says Charge Sheet Against Najib Is False, an Attempt to Topple PM",55bb89a079881073c9554efb,None,"Malaysia's newly-appointed attorney general said on Friday a purported draft of a charge sheet against Prime Minister Najib Razak published on the Sarawak Report website was false, and part of a plot to topple the country's leader.",World,Asia Pacific,"Malaysia Says Charge Sheet Against Najib Is False, an Attempt to Topple PM Malaysia's newly-appointed attorney general said on Friday a purported draft of a charge sheet against Prime Minister Najib Razak published on the Sarawak Report website was false, and part of a plot to topple the country's leader.  ",News
525,"Our Summer Reading Contest is now in its eighth week. To participate, post a comment here by 7 a.m. Eastern on Aug. 7 and answer the question “What interested you most in The Times this week?”",2015-07-31,blogpost,"Summer Reading Contest, Week 8 | What Interested You Most in The Times This Week?",55bb56a579881073c9554e56,,,Education,,"Summer Reading Contest, Week 8 | What Interested You Most in The Times This Week?   Our Summer Reading Contest is now in its eighth week. To participate, post a comment here by 7 a.m. Eastern on Aug. 7 and answer the question “What interested you most in The Times this week?”",Blog
526,All the places you should be hanging out online this week.,2015-08-10,blogpost,"Haruki Murakami&#8217;s Virtual Desk Tour, Lenny&#8217;s Head Start and an Instagram That Marries Art and Eats",55c921987988100fc7f12bc9,TStyle,,T Magazine,,"Haruki Murakami&#8217;s Virtual Desk Tour, Lenny&#8217;s Head Start and an Instagram That Marries Art and Eats   All the places you should be hanging out online this week.",Blog
527,,2015-08-04,article,Eco-Friendly 3D Printed Supercar,55c0ee8d79881053589a0753,None,By Ben Gruber,Technology,,Eco-Friendly 3D Printed Supercar By Ben Gruber  ,News
528,,2015-08-03,article,Attorney to Review Surveillance of Man Charged in Bomb Plot,55bf874c7988102ce5b0d105,None,A bail hearing was postponed Monday for a Florida Keys man described by the FBI as an Islamic State sympathizer who plotted to detonate a backpack bomb at a beach.,U.S.,,Attorney to Review Surveillance of Man Charged in Bomb Plot A bail hearing was postponed Monday for a Florida Keys man described by the FBI as an Islamic State sympathizer who plotted to detonate a backpack bomb at a beach.  ,News
529,"Millions of dollars in donations to the group, Right to Rise USA, came from Bush family members, former presidential appointees, and prominent Republican donors.",2015-07-31,blogpost,Familiar Names Gave Big to Jeb Bush-Aligned &#8216;Super PAC&#8217;,55bb8fec79881073c9554f1d,Politics,,false,false,"Familiar Names Gave Big to Jeb Bush-Aligned &#8216;Super PAC&#8217;   Millions of dollars in donations to the group, Right to Rise USA, came from Bush family members, former presidential appointees, and prominent Republican donors.",Blog
530,,2015-07-29,article,Malaysia’s Premier Dismisses Deputy and Attorney General Amid Scandal,55b750347988101c94458fb8,Foreign,The cabinet reshuffle came two days after the deputy called on Prime Minister Najib Razak to answer questions about a heavily indebted government-run fund.,World,Asia Pacific,Malaysia’s Premier Dismisses Deputy and Attorney General Amid Scandal The cabinet reshuffle came two days after the deputy called on Prime Minister Najib Razak to answer questions about a heavily indebted government-run fund.  ,News
531,,2015-08-11,article,Asian Shares Fall as China Currency Weakens Further,55c9b7297988100fc7f12cf1,None,Asian stock markets fell Wednesday in spillover from the global sell-off spurred by China's move a day earlier to devalue its currency.,World,Asia Pacific,Asian Shares Fall as China Currency Weakens Further Asian stock markets fell Wednesday in spillover from the global sell-off spurred by China's move a day earlier to devalue its currency.  ,News
532,,2015-08-06,article,No Charges Against Police in Maryland Stun Gun Death,55c3800a7988107e31ff1aa5,None,"Five Hagerstown police officers involved in the stun-gun-related death of a home invasion suspect won't be criminally charged, authorities said Thursday, citing an autopsy report's finding that the man died from drug-induced ""excited delirium in the setting of police restraint.""",U.S.,,"No Charges Against Police in Maryland Stun Gun Death Five Hagerstown police officers involved in the stun-gun-related death of a home invasion suspect won't be criminally charged, authorities said Thursday, citing an autopsy report's finding that the man died from drug-induced ""excited delirium in the setting of police restraint.""  ",News
533,,2015-08-03,article,Get Started: Employee or Freelancer? Govt Issues Opinion,55bf89737988102ce5b0d10d,None,EMPLOYEE OR FREELANCER?,Business Day,,Get Started: Employee or Freelancer? Govt Issues Opinion EMPLOYEE OR FREELANCER?  ,News
534,,2015-07-30,article,Ex-NY Senate Leader Heading to Trial on Corruption Charges,55ba4925798810561813c4be,None,A former state Senate leader is set to go to trial this fall on charges he sold his office for the sake of his adult son.,U.S.,,Ex-NY Senate Leader Heading to Trial on Corruption Charges A former state Senate leader is set to go to trial this fall on charges he sold his office for the sake of his adult son.  ,News
535,,2015-07-29,article,"Poland's Richest Man, Jan Kulczyk, Dies at 65",55b884db7988103b2266ccdb,None,"Poland's richest man, Jan Kulczyk, died in Vienna on Tuesday  from complications after surgery, a spokeswoman at Kulczyk Holding, the company he founded, said. He was 65.",World,Europe,"Poland's Richest Man, Jan Kulczyk, Dies at 65 Poland's richest man, Jan Kulczyk, died in Vienna on Tuesday  from complications after surgery, a spokeswoman at Kulczyk Holding, the company he founded, said. He was 65.  ",News
536,,2015-07-28,article,U.N. Aid Chief Says No Warring Parties Observed Yemen Truce,55b804327988103b2266cbcc,None,United Nations aid chief Stephen O'Brien said on Tuesday none of the warring parties in Yemen had observed a humanitarian pause in fighting announced by the Saudi Arabia-led coalition forces and accused both sides of failing to respect international law.,World,Middle East,U.N. Aid Chief Says No Warring Parties Observed Yemen Truce United Nations aid chief Stephen O'Brien said on Tuesday none of the warring parties in Yemen had observed a humanitarian pause in fighting announced by the Saudi Arabia-led coalition forces and accused both sides of failing to respect international law.  ,News
537,Rite Aid and Food Lion will put issues of Cosmopolitan magazine behind holders that will prevent minors from seeing magazine's sexual content.,2015-08-01,article,Cosmopolitan Magazine Covers to Be Shielded by 2 Retailers,55bc2c6879881012a690aea9,Business,"Rite Aid and Food Lion plan to shield the content on the covers from minors, in response to a campaign by the National Center on Sexual Exploitation.",Business Day,Media,"Cosmopolitan Magazine Covers to Be Shielded by 2 Retailers Rite Aid and Food Lion plan to shield the content on the covers from minors, in response to a campaign by the National Center on Sexual Exploitation. Rite Aid and Food Lion will put issues of Cosmopolitan magazine behind holders that will prevent minors from seeing magazine's sexual content.",News
538,,2015-07-31,article,"After Merck Success, Work Goes on With Other Ebola Vaccines",55bbd42e79881012a690add6,None,"Scientists and drug companies will continue to research the potential of alternative Ebola vaccines, despite a shot from Merck&#160;&#160;and NewLink Genetics proving 100 percent effective in a trial in Guinea.",World,Europe,"After Merck Success, Work Goes on With Other Ebola Vaccines Scientists and drug companies will continue to research the potential of alternative Ebola vaccines, despite a shot from Merck&#160;&#160;and NewLink Genetics proving 100 percent effective in a trial in Guinea.  ",News
539,,2015-07-28,article,Billy Hurley III Says His Father Has Been Missing for 9 Days,55b7cb5f7988103b2266cb0b,None,Billy Hurley III took a few questions about his struggles on the golf course and his ties to northern Virginia before a PGA Tour official said Hurley had an announcement.,Sports,Golf,Billy Hurley III Says His Father Has Been Missing for 9 Days Billy Hurley III took a few questions about his struggles on the golf course and his ties to northern Virginia before a PGA Tour official said Hurley had an announcement.  ,News
540,,2015-08-03,article,Arizona Man Says He Beheaded Wife 'to Get the Evil Out': Police,55bfe8fa79881038277d8619,None,"An Arizona man who admitted to decapitating his wife and her two dogs in a bloody incident last month in Phoenix told authorities he was attempting ""to get the evil out"" of her, according to court documents released on Monday.",U.S.,,"Arizona Man Says He Beheaded Wife 'to Get the Evil Out': Police An Arizona man who admitted to decapitating his wife and her two dogs in a bloody incident last month in Phoenix told authorities he was attempting ""to get the evil out"" of her, according to court documents released on Monday.  ",News
541,The latest undercover video shows how committed the group’s opponents are to paint it as something it is not.,2015-07-29,blogpost,The Propaganda Campaign to Misrepresent Planned Parenthood,55b92e19798810561813c1bc,OpEd,,false,false,The Propaganda Campaign to Misrepresent Planned Parenthood   The latest undercover video shows how committed the group’s opponents are to paint it as something it is not.,Blog
542,,2015-07-28,article,California Lawmaker Battles Recall by Anti-Vaccine Activists,55b812f77988103b2266cbe4,None,"The California lawmker who made it harder for parents to opt out of vaccinating their children, a stance that earned him death threats, is now launching a campaign to save his job, days after the state certified a recall effort against him.",U.S.,,"California Lawmaker Battles Recall by Anti-Vaccine Activists The California lawmker who made it harder for parents to opt out of vaccinating their children, a stance that earned him death threats, is now launching a campaign to save his job, days after the state certified a recall effort against him.  ",News
543,,2015-08-10,article,New York City's 'Responsible Banking' Law Ruled Unconstitutional,55c8b67f7988107a9cc5c7c8,None,"The law, which called for banks holding the city’s over $6 billion in deposits to document how well they meet the needs of low-income neighborhoods, is unconstitutional, a federal judge has ruled.",Business Day,,"New York City's 'Responsible Banking' Law Ruled Unconstitutional The law, which called for banks holding the city’s over $6 billion in deposits to document how well they meet the needs of low-income neighborhoods, is unconstitutional, a federal judge has ruled.  ",News
544,,2015-08-06,article,"Congress Breaks, Leaving a Fall Full of Deadlines",55c30b4a7988107e31ff1975,None,"The House has left town for its August recess and the Senate is departing, which leaves a hefty list of unfinished business. Lawmakers have just 10 legislative days in September to ensure that the government stays open.",U.S.,Politics,"Congress Breaks, Leaving a Fall Full of Deadlines The House has left town for its August recess and the Senate is departing, which leaves a hefty list of unfinished business. Lawmakers have just 10 legislative days in September to ensure that the government stays open.  ",News
545,,2015-08-04,article,Kellogg's US Breakfast Business Shrinks Again,55c0b2cc79881038277d87cc,None,Kellogg says its U.S. breakfast foods division saw another decline in quarterly sales but that trends in the cereal category were improving.,Business Day,,Kellogg's US Breakfast Business Shrinks Again Kellogg says its U.S. breakfast foods division saw another decline in quarterly sales but that trends in the cereal category were improving.  ,News
