,abstract,date,doctype,headline,id,news_desk,paragraph,section,subsection,text,type
246,,2015-07-29,article,"Outside Auditors Should Check Bank Capital, UK Industry Body Says",55b8c85d7988103b2266cda3,None,"Asking outside auditors to vouch for the accuracy of a bank's key measure of health could help restore investor trust in the sector, a London-based accounting body said on Wednesday.",Business Day,,"Outside Auditors Should Check Bank Capital, UK Industry Body Says Asking outside auditors to vouch for the accuracy of a bank's key measure of health could help restore investor trust in the sector, a London-based accounting body said on Wednesday.  ",News
247,,2015-08-09,article,Man Dies After Being Shocked With a Taser by a Hartford Police Officer,55c6921b7988106f6132dfaa,Metro,The Connecticut State Police are investigating the death of a 26-year-old man after a call reporting a medical disturbance.,N.Y. / Region,,Man Dies After Being Shocked With a Taser by a Hartford Police Officer The Connecticut State Police are investigating the death of a 26-year-old man after a call reporting a medical disturbance.  ,News
248,,2015-08-07,article,Hepatitis Increasingly Goes Hand in Hand With Heroin Abuse,55c4bbb3798810228c90e36e,None,"Public health agencies and drug treatment centers nationwide are scrambling to battle an explosive increase in cases of hepatitis C, a scourge they believe stems at least in part from a surge in intravenous heroin use.",U.S.,,"Hepatitis Increasingly Goes Hand in Hand With Heroin Abuse Public health agencies and drug treatment centers nationwide are scrambling to battle an explosive increase in cases of hepatitis C, a scourge they believe stems at least in part from a surge in intravenous heroin use.  ",News
249,"Data from 485,000 people in China found that rates of ischemic heart disease, respiratory disease and cancer were all lower in hot-food eaters.",2015-08-04,blogpost,Eating Spicy Food Linked to a Longer Life,55c13d6879881053589a0874,Science,,Health,,"Eating Spicy Food Linked to a Longer Life   Data from 485,000 people in China found that rates of ischemic heart disease, respiratory disease and cancer were all lower in hot-food eaters.",Blog
250,,2015-08-04,article,Indian Rapper Goes Viral With Toxic Waste Gibes at Unilever,55c07cab79881038277d873d,None,An Indian rapper has gone viral with a music video calling on consumer products giant Unilever to clean up alleged toxic waste from a forested southern hill station.,Arts,,Indian Rapper Goes Viral With Toxic Waste Gibes at Unilever An Indian rapper has gone viral with a music video calling on consumer products giant Unilever to clean up alleged toxic waste from a forested southern hill station.  ,News
251,,2015-08-11,article,Scorching Heatwave in Egypt Leaves 42 Dead,55c9f88f7988100fc7f12da7,None,"A scorching heatwave in Egypt turned deadly this week, killing at least 42 people, including a German resident, patients in a psychiatric hospital and detainees, officials said Tuesday.",World,Middle East,"Scorching Heatwave in Egypt Leaves 42 Dead A scorching heatwave in Egypt turned deadly this week, killing at least 42 people, including a German resident, patients in a psychiatric hospital and detainees, officials said Tuesday.  ",News
252,"Senate Republicans’ latest ploy to choke off all federal funding to Planned Parenthood failed, but it shouldn’t have made it as far as it did.",2015-08-03,blogpost,The Failed Attack on Planned Parenthood,55bffbd979881038277d8643,OpEd,,false,false,"The Failed Attack on Planned Parenthood   Senate Republicans’ latest ploy to choke off all federal funding to Planned Parenthood failed, but it shouldn’t have made it as far as it did.",Blog
253,,2015-08-03,article,Task Force Urges More Research Into Child Autism Screening,55bfe66c79881038277d860f,None,A government task force says more research is needed to determine if toddlers should be screened for autism even if check-ups or parents haven't spotted developmental problems &#8212; despite guidelines from other health groups that urge such screening.,Health,,Task Force Urges More Research Into Child Autism Screening A government task force says more research is needed to determine if toddlers should be screened for autism even if check-ups or parents haven't spotted developmental problems &#8212; despite guidelines from other health groups that urge such screening.  ,News
254,,2015-07-29,article,Britain's Capita Sees Organic Growth Accelerating in 2016,55b871337988103b2266cc8f,None,British outsourcing group Capita said it expected organic revenue growth to accelerate in 2016 after it posted an 11 percent rise in first-half pretax profit and secured 1.6 billion pounds of major contract wins.,Business Day,,Britain's Capita Sees Organic Growth Accelerating in 2016 British outsourcing group Capita said it expected organic revenue growth to accelerate in 2016 after it posted an 11 percent rise in first-half pretax profit and secured 1.6 billion pounds of major contract wins.  ,News
255,,2015-08-09,article,BY THE NUMBERS: The Atomic Bombing of Nagasaki,55c6e1827988106f6132e01e,None,"The Japanese city of Nagasaki marked Sunday the 70th anniversary of the U.S. atomic bombing on Aug. 9, 1945, three days after the first atomic bomb was dropped on Hiroshima. Japan surrendered on Aug. 15, ending World War II. Here's a look, by the numbers, at that day 70 years ago in Nagasaki:",U.S.,,"BY THE NUMBERS: The Atomic Bombing of Nagasaki The Japanese city of Nagasaki marked Sunday the 70th anniversary of the U.S. atomic bombing on Aug. 9, 1945, three days after the first atomic bomb was dropped on Hiroshima. Japan surrendered on Aug. 15, ending World War II. Here's a look, by the numbers, at that day 70 years ago in Nagasaki:  ",News
256,Daniel M Gold reviews Damon Gameau documentary film That Sugar Film.,2015-07-31,article,"Review: In &#8216;That Sugar Film,&#8217; a Bitter Truth",55bad27d79881073c9554d26,Weekend,"For this documentary, the director and actor Damon Gameau subjects himself to a high sugar diet, by way of juice, yogurt and cereal.",Movies,,"Review: In &#8216;That Sugar Film,&#8217; a Bitter Truth For this documentary, the director and actor Damon Gameau subjects himself to a high sugar diet, by way of juice, yogurt and cereal. Daniel M Gold reviews Damon Gameau documentary film That Sugar Film.",Review
257,,2015-07-30,article,5 Things to Know About Filthy Water Awaiting Rio Olympians,55ba953f79881073c9554c74,None,The Associated Press commissioned a study of the virus and bacteria levels in the waters where Olympic athletes will compete next year in Rio de Janeiro. The testing found dangerously high levels of pathogens from human sewage waste.,Sports,Olympics,5 Things to Know About Filthy Water Awaiting Rio Olympians The Associated Press commissioned a study of the virus and bacteria levels in the waters where Olympic athletes will compete next year in Rio de Janeiro. The testing found dangerously high levels of pathogens from human sewage waste.  ,News
258,,2015-08-01,article,Woman Gets Probation in Boyfriend's Death by Neglect,55bd767e7988102a810a4c9b,None,"A South Carolina woman has been sentenced to five years of probation for fatally neglecting her boyfriend, who died several months after being taken to the hospital with bedsores, mold in his catheter and bug bites.",U.S.,,"Woman Gets Probation in Boyfriend's Death by Neglect A South Carolina woman has been sentenced to five years of probation for fatally neglecting her boyfriend, who died several months after being taken to the hospital with bedsores, mold in his catheter and bug bites.  ",News
259,,2015-08-08,article,Wastewater Spill in Colorado Turns a River Yellow,55c565bd7988104f5eefc2e4,National,"The Environmental Protection Agency, which caused the spill while it was investigating a leak at the Gold King Mine, confirmed the wastewater contained heavy metals.",U.S.,,"Wastewater Spill in Colorado Turns a River Yellow The Environmental Protection Agency, which caused the spill while it was investigating a leak at the Gold King Mine, confirmed the wastewater contained heavy metals.  ",News
260,,2015-08-11,article,GSK Closes North Carolina Plant After Legionnaires' Bacteria Found,55ca83be798810348576cc27,None,"Drugmaker GlaxoSmithKline closed its North Carolina factory on Tuesday after testing at a cooling tower found bacteria that causes deadly Legionnaire's disease, a company spokeswoman said.",Business Day,,"GSK Closes North Carolina Plant After Legionnaires' Bacteria Found Drugmaker GlaxoSmithKline closed its North Carolina factory on Tuesday after testing at a cooling tower found bacteria that causes deadly Legionnaire's disease, a company spokeswoman said.  ",News
261,,2015-08-10,article,Oklahoma Judge Strikes Down Law Limiting Use of Abortion-Inducing Pills,55c92a7d7988100fc7f12be0,None,"An Oklahoma judge struck down on Monday a law aimed at limiting the use of abortion-inducing drugs, saying the measure was unconstitutional because it did not apply to other medication.",U.S.,,"Oklahoma Judge Strikes Down Law Limiting Use of Abortion-Inducing Pills An Oklahoma judge struck down on Monday a law aimed at limiting the use of abortion-inducing drugs, saying the measure was unconstitutional because it did not apply to other medication.  ",News
262,,2015-08-06,article,Argentine Ex-President a No-Show at Trial Over Bombing Cover-Up,55c3a973798810228c90e0a2,None,Former Argentine President Carlos Menem failed to appear Thursday at the opening of his trial for allegedly conspiring to derail an investigation into the 1994 bombing of a Jewish community center in Buenos Aires.,World,Middle East,Argentine Ex-President a No-Show at Trial Over Bombing Cover-Up Former Argentine President Carlos Menem failed to appear Thursday at the opening of his trial for allegedly conspiring to derail an investigation into the 1994 bombing of a Jewish community center in Buenos Aires.  ,News
263,,2015-08-01,article,"Four Dead, 65 Sick in New York City Legionnaires' Disease Outbreak",55bd31927988102a810a4c61,None,"A deadly outbreak of Legionnaires' disease, a severe type of pneumonia, has now killed four people and sickened 65 in the Bronx section of New York City since July 10, New York City health officials said on Saturday.",U.S.,,"Four Dead, 65 Sick in New York City Legionnaires' Disease Outbreak A deadly outbreak of Legionnaires' disease, a severe type of pneumonia, has now killed four people and sickened 65 in the Bronx section of New York City since July 10, New York City health officials said on Saturday.  ",News
264,,2015-07-29,article,UN: Expect 11.2 Billion Population by the End of the Century,55b90875798810561813c13b,None,"Move over: The world's population is expected to reach 8.5 billion by 2030 and 9.7 billion in 2050, a new United Nations report says. And there should be 11.2 billion people on Earth by the end of this century.",World,,"UN: Expect 11.2 Billion Population by the End of the Century Move over: The world's population is expected to reach 8.5 billion by 2030 and 9.7 billion in 2050, a new United Nations report says. And there should be 11.2 billion people on Earth by the end of this century.  ",News
265,,2015-07-29,article,"Islamic State Claims Car Bomb in Yemen Capital, Four Dead",55b8daa97988103b2266cdd7,None,"A car bomb exploded outside an Ismaili mosque in Yemen's war-damaged capital Sanaa on Wednesday, killing four people and wounding six, health authorities and a security source said.",World,Middle East,"Islamic State Claims Car Bomb in Yemen Capital, Four Dead A car bomb exploded outside an Ismaili mosque in Yemen's war-damaged capital Sanaa on Wednesday, killing four people and wounding six, health authorities and a security source said.  ",News
266,,2015-07-30,article,5 Things to Know About Filthy Water Awaiting Rio Olympians,55b9a3cb798810561813c2df,None,The Associated Press commissioned a study of the virus and bacteria levels in the waters where Olympic athletes will compete next year in Rio de Janeiro. The testing found dangerously high levels of pathogens from human sewage waste.,Sports,Olympics,5 Things to Know About Filthy Water Awaiting Rio Olympians The Associated Press commissioned a study of the virus and bacteria levels in the waters where Olympic athletes will compete next year in Rio de Janeiro. The testing found dangerously high levels of pathogens from human sewage waste.  ,News
267,,2015-08-05,article,Adidas Buys Fitness Tracking App Maker Runtastic,55c23b1e7988107e31ff173e,None,"Adidas AG has bought fitness tracking app maker Runtastic, giving it access to a community of 70 million active users and helping it catch rivals in connected wearables.",Technology,,"Adidas Buys Fitness Tracking App Maker Runtastic Adidas AG has bought fitness tracking app maker Runtastic, giving it access to a community of 70 million active users and helping it catch rivals in connected wearables.  ",News
268,"The company supports a new nonprofit, the Global Energy Balance Network, that promotes a “science-based” approach to weight control: Get more exercise and worry less about cutting calories.",2015-08-09,blogpost,Coca-Cola Funds Scientists Who Shift Blame for Obesity Away From Bad Diets,55c7c5b77988107a9cc5c5fc,Science,,Health,,"Coca-Cola Funds Scientists Who Shift Blame for Obesity Away From Bad Diets   The company supports a new nonprofit, the Global Energy Balance Network, that promotes a “science-based” approach to weight control: Get more exercise and worry less about cutting calories.",Blog
269,,2015-07-31,article,Vaccine Success Holds Hope for End to Deadly Scourge of Ebola,55bb672679881073c9554e83,None,"The world is on the verge of being able to protect humans against Ebola, the World Health Organization said on Friday, as a trial in Guinea found a vaccine to have been 100 percent effective.",World,Europe,"Vaccine Success Holds Hope for End to Deadly Scourge of Ebola The world is on the verge of being able to protect humans against Ebola, the World Health Organization said on Friday, as a trial in Guinea found a vaccine to have been 100 percent effective.  ",News
270,,2015-08-07,article,The Abortion Debate: Strong Views All Around,55c45c62798810228c90e26c,Letters,Readers discuss Katha Pollitt’s idea that women who have had abortions should speak out.,Opinion,,The Abortion Debate: Strong Views All Around Readers discuss Katha Pollitt’s idea that women who have had abortions should speak out.  ,Letter
271,,2015-08-04,article,NAACP Chapter President Says Police Used Force on Sister,55c1371179881053589a0862,None,"An NAACP chapter president says police in Eugene, Oregon, used excessive force on his sister after she tried to stop an officer from deploying a Taser stun gun on her 19-year-old son.",U.S.,,"NAACP Chapter President Says Police Used Force on Sister An NAACP chapter president says police in Eugene, Oregon, used excessive force on his sister after she tried to stop an officer from deploying a Taser stun gun on her 19-year-old son.  ",News
272,,2015-08-04,article,More Fights Ahead on Planned Parenthood After Senate Vote,55c0657779881038277d8704,None,"After the Senate's derailing of Republican legislation halting federal dollars for Planned Parenthood, one thing seems clear: Many on both sides think they can ring up gains from the battle.",U.S.,Politics,"More Fights Ahead on Planned Parenthood After Senate Vote After the Senate's derailing of Republican legislation halting federal dollars for Planned Parenthood, one thing seems clear: Many on both sides think they can ring up gains from the battle.  ",News
273,,2015-08-01,article,Charity Hospital Replacement Opens Saturday in New Orleans,55bcf19e7988102a810a4bfc,None,"Ten years after the levees and floodwalls broke during Hurricane Katrina and flooded New Orleans, the Big Easy finally has a full-scale hospital again &#8212; a new Charity hospital.",U.S.,,"Charity Hospital Replacement Opens Saturday in New Orleans Ten years after the levees and floodwalls broke during Hurricane Katrina and flooded New Orleans, the Big Easy finally has a full-scale hospital again &#8212; a new Charity hospital.  ",News
274,,2015-07-29,article,"Immigrants, Poor Fish for Their Dinner, Unaware of Mercury",55b863d87988103b2266cc79,None,"It's midday and the white bucket balanced on the rocky shore at Mountha Uppasay's feet holds five or six white bass, moving sluggishly in the water she scooped from the Des Moines River.",U.S.,,"Immigrants, Poor Fish for Their Dinner, Unaware of Mercury It's midday and the white bucket balanced on the rocky shore at Mountha Uppasay's feet holds five or six white bass, moving sluggishly in the water she scooped from the Des Moines River.  ",News
275,,2015-07-29,article,Then & Now: Medicare and Medicaid Turn 50,55b87e987988103b2266ccc2,None,"When President Lyndon B. Johnson signed Medicare and Medicaid into law on July 30, 1965, roughly half of Americans 65 and older had no health insurance.",U.S.,Politics,"Then & Now: Medicare and Medicaid Turn 50 When President Lyndon B. Johnson signed Medicare and Medicaid into law on July 30, 1965, roughly half of Americans 65 and older had no health insurance.  ",News
276,,2015-07-30,article,AP Investigation: Filthy Rio Water a Threat at 2016 Olympics,55ba50c979881073c9554b68,None,"The waters where Olympians will compete in swimming and boating events next summer in South America's first games are rife with human sewage and present a serious health risk for athletes, as well as for visitors to the iconic beaches of Rio de Janeiro.",Sports,Olympics,"AP Investigation: Filthy Rio Water a Threat at 2016 Olympics The waters where Olympians will compete in swimming and boating events next summer in South America's first games are rife with human sewage and present a serious health risk for athletes, as well as for visitors to the iconic beaches of Rio de Janeiro.  ",News
277,"“Fat” cartoon characters may lead children to eat more junk food, new research suggests, but there are ways to counter this effect.",2015-07-28,blogpost,&#8216;Fat&#8217; Cartoon Characters May Make Children Eat More,55b74f877988101c94458fb6,Science,,false,false,"&#8216;Fat&#8217; Cartoon Characters May Make Children Eat More   “Fat” cartoon characters may lead children to eat more junk food, new research suggests, but there are ways to counter this effect.",Blog
278,,2015-07-28,article,Should Doctors Get Report Cards?,55b72d707988101c94458f45,Letters,Doctors and a patient discuss the value of giving grades to doctors.,Opinion,,Should Doctors Get Report Cards? Doctors and a patient discuss the value of giving grades to doctors.  ,Letter
279,,2015-07-30,article,Vegas-Area Coal Plant Owners to Pay $4.3M to Settle Lawsuit,55ba7f3d79881073c9554c0e,None,Owners of a soon-to-close coal-fired power plant outside Las Vegas have agreed to pay $4.3 million to settle a lawsuit and clean up contamination that neighboring Native Americans blame for health problems and water pollution.,U.S.,,Vegas-Area Coal Plant Owners to Pay $4.3M to Settle Lawsuit Owners of a soon-to-close coal-fired power plant outside Las Vegas have agreed to pay $4.3 million to settle a lawsuit and clean up contamination that neighboring Native Americans blame for health problems and water pollution.  ,News
280,,2015-08-07,article,"Meningitis Epidemic Threat in West Africa, but Few Vaccines",55c49674798810228c90e304,None,"International health officials are scrambling, without much success, to find meningitis C vaccines as an outbreak of the child-killing disease threatens to balloon into an epidemic.",World,Africa,"Meningitis Epidemic Threat in West Africa, but Few Vaccines International health officials are scrambling, without much success, to find meningitis C vaccines as an outbreak of the child-killing disease threatens to balloon into an epidemic.  ",News
281,,2015-07-28,article,Warplanes Attack Air Base Near Yemen's Aden,55b7afd27988103b2266caa5,None,"Warplanes attacked Houthi militia in control of Yemen's largest air base north of Aden on Tuesday, seeking to expand territorial gains made by Saudi-led coalition forces since they captured the southern port city last week.",World,Middle East,"Warplanes Attack Air Base Near Yemen's Aden Warplanes attacked Houthi militia in control of Yemen's largest air base north of Aden on Tuesday, seeking to expand territorial gains made by Saudi-led coalition forces since they captured the southern port city last week.  ",News
282,"Irregular and on-call scheduling increases workers’ stress and family conflicts, recent research shows.",2015-08-10,blogpost,"Unpredictable Work Hours, Chaotic Life",55c8d4c17988100fc7f12ae7,OpEd,,Opinion,,"Unpredictable Work Hours, Chaotic Life   Irregular and on-call scheduling increases workers’ stress and family conflicts, recent research shows.",Blog
283,,2015-07-28,article,Killing Raises Questions About Man's Release From Hospital,55b799627988101c9445907f,None,"A Phoenix man suspected of decapitating his wife and mutilating himself had spent about 10 years in the state mental hospital for stabbing a relative before he was recently released from custody, court records obtained Tuesday show.",U.S.,,"Killing Raises Questions About Man's Release From Hospital A Phoenix man suspected of decapitating his wife and mutilating himself had spent about 10 years in the state mental hospital for stabbing a relative before he was recently released from custody, court records obtained Tuesday show.  ",News
284,,2015-07-30,article,Scientist: Oil Slick Likely From Natural Seafloor Seepage,55b9c863798810561813c332,None,"Coast Guard officials say it will likely be a couple more days before they can definitively say what caused a miles-long oil slick to materialize off the Santa Barbara County coast this week, but an expert said Thursday it was more than likely the result of ocean-floor seepage.",U.S.,,"Scientist: Oil Slick Likely From Natural Seafloor Seepage Coast Guard officials say it will likely be a couple more days before they can definitively say what caused a miles-long oil slick to materialize off the Santa Barbara County coast this week, but an expert said Thursday it was more than likely the result of ocean-floor seepage.  ",News
285,,2015-07-30,article,Texas Trooper's Boss Says He Had Reason to Stop Sandra Bland,55ba9ab479881073c9554c86,None,The top boss over the Texas trooper who arrested Sandra Bland said there was reason to pull her over for failing to signal a lane change and told lawmakers Thursday that the trooper remains on the state payroll because the investigation is still playing out.,U.S.,,Texas Trooper's Boss Says He Had Reason to Stop Sandra Bland The top boss over the Texas trooper who arrested Sandra Bland said there was reason to pull her over for failing to signal a lane change and told lawmakers Thursday that the trooper remains on the state payroll because the investigation is still playing out.  ,News
286,,2015-08-05,article,Texas AG Faces Contempt Hearing Over Gay Marriage Rights,55c28c257988107e31ff1864,None,"Texas Attorney General Ken Paxton must explain why he should not be held in contempt for enforcing state laws that impede gay marriage rights after the U.S. Supreme Court's landmark decision, a federal judge ordered Wednesday.",U.S.,,"Texas AG Faces Contempt Hearing Over Gay Marriage Rights Texas Attorney General Ken Paxton must explain why he should not be held in contempt for enforcing state laws that impede gay marriage rights after the U.S. Supreme Court's landmark decision, a federal judge ordered Wednesday.  ",News
287,,2015-08-10,article,Strep's Evolution May Provide Clues for Developing a Vaccine,55c903f97988100fc7f12b76,None,"The same bacteria that cause simple strep throat sometimes trigger bloodstream or even flesh-eating infections instead, and over the years, dangerous cases have increased. Now researchers have uncovered how some strains of this bug evolved to become more aggressive.",Health,,"Strep's Evolution May Provide Clues for Developing a Vaccine The same bacteria that cause simple strep throat sometimes trigger bloodstream or even flesh-eating infections instead, and over the years, dangerous cases have increased. Now researchers have uncovered how some strains of this bug evolved to become more aggressive.  ",News
288,,2015-08-04,article,Amnesty International Accuses Sudanese Forces of War Crimes,55c107f479881053589a07a2,None,"Amnesty International said Tuesday it has ""definitely confirmed"" that Sudanese government forces committed war crimes against civilians in the South Kordofan region.",World,Middle East,"Amnesty International Accuses Sudanese Forces of War Crimes Amnesty International said Tuesday it has ""definitely confirmed"" that Sudanese government forces committed war crimes against civilians in the South Kordofan region.  ",News
289,,2015-08-02,article,"Erin Kuykendall,  Abraham Thomas",55bd99567988102a810a4cd7,Society,The bride is the curator of collections for Tudor Place History House & Garden in Washington. The groom the director of Sir John Soane’s Museum in London.,Fashion & Style,Weddings,"Erin Kuykendall,  Abraham Thomas The bride is the curator of collections for Tudor Place History House & Garden in Washington. The groom the director of Sir John Soane’s Museum in London.  ",News
290,,2015-08-09,article,"Nicole Teibel, Taylor Boyd",55c6d3da7988106f6132e016,Society,"The couple met at North Carolina State in Raleigh, from which they graduated.",Fashion & Style,Weddings,"Nicole Teibel, Taylor Boyd The couple met at North Carolina State in Raleigh, from which they graduated.  ",News
