,abstract,date,doctype,headline,id,news_desk,paragraph,section,subsection,text,type
755,,2015-08-04,article,"European CEOs Shrug Off Greece, See Recovery Gaining Pace",55c091be79881038277d8783,None,"Businesses in Europe said a weak euro, cheaper oil and the European Central Bank&#8217;s easy money policies drove a continued improvement in profitability in the second quarter, encouraging some companies to invest and hire more.",Business Day,,"European CEOs Shrug Off Greece, See Recovery Gaining Pace Businesses in Europe said a weak euro, cheaper oil and the European Central Bank&#8217;s easy money policies drove a continued improvement in profitability in the second quarter, encouraging some companies to invest and hire more.  ",News
756,Nine people are injured in shootings at family party in East New York section of Brooklyn; at least two gunmen open fire in one of at least two incidents of gun-related violence in city over weekend.,2015-08-03,article,9 Injured in Shooting in Brooklyn,55be24497988102a810a4d8f,Metro,The violence came after a week of relative calm in New York in which shootings were sharply down in some precincts compared with the same period last year.,N.Y. / Region,,9 Injured in Shooting in Brooklyn The violence came after a week of relative calm in New York in which shootings were sharply down in some precincts compared with the same period last year. Nine people are injured in shootings at family party in East New York section of Brooklyn; at least two gunmen open fire in one of at least two incidents of gun-related violence in city over weekend.,News
757,,2015-07-31,article,Western Companies Look Hard at China as Growth Slows,55bb9c9479881012a690aced,None,"The Chinese slowdown is forcing many Western companies to take a hard look at their businesses there, leading many to reduce investments, costs and product lines and to tackle increasing bad debts.",Business Day,,"Western Companies Look Hard at China as Growth Slows The Chinese slowdown is forcing many Western companies to take a hard look at their businesses there, leading many to reduce investments, costs and product lines and to tackle increasing bad debts.  ",News
758,,2015-07-31,article,Monster of a Fall Awaits Congress After Summer Break,55bb288079881073c9554dcb,None,"As lawmakers head out of the Capitol for a five-week summer recess, they leave behind a pile of unfinished business that all but guarantees a painful fall.",U.S.,Politics,"Monster of a Fall Awaits Congress After Summer Break As lawmakers head out of the Capitol for a five-week summer recess, they leave behind a pile of unfinished business that all but guarantees a painful fall.  ",News
759,,2015-07-29,article,"House Votes to Provide Money for Highways, Transit",55b87bc67988103b2266ccb4,None,"The House voted overwhelmingly on Wednesday to shore up federal highway aid and veterans' health care before heading out of town for its August recess, leaving unresolved an array of sticky issues that are sure to complicate an autumn agenda already groaning under the weight of indecision.",U.S.,Politics,"House Votes to Provide Money for Highways, Transit The House voted overwhelmingly on Wednesday to shore up federal highway aid and veterans' health care before heading out of town for its August recess, leaving unresolved an array of sticky issues that are sure to complicate an autumn agenda already groaning under the weight of indecision.  ",News
760,Teva Pharmaceuticals announces agreement to acquire generic drug business of Allergan for $40.5 billion; acquisition sets stage for further mergers in pharmaceutical industry.,2015-07-28,article,Teva Pharmaceuticals to Buy Allergan’s Generics Business,55b5fa63798810098f9ef76d,Business,The $40.5 billion transaction would be the latest in what has been a frenzied period of deal-making in the pharmaceutical sector.,Business Day,DealBook,Teva Pharmaceuticals to Buy Allergan’s Generics Business The $40.5 billion transaction would be the latest in what has been a frenzied period of deal-making in the pharmaceutical sector. Teva Pharmaceuticals announces agreement to acquire generic drug business of Allergan for $40.5 billion; acquisition sets stage for further mergers in pharmaceutical industry.,News
761,,2015-08-11,article,Iraq Parliament Votes to Transform Ruling System in Boost for Abadi,55c9be2e7988100fc7f12d15,None,"Iraq's parliament voted unanimously on Tuesday for the biggest shakeup in its governing system since the U.S. military occupation, eliminating entire layers of government and giving Prime Minister Haider al-Abadi new powers.",World,Middle East,"Iraq Parliament Votes to Transform Ruling System in Boost for Abadi Iraq's parliament voted unanimously on Tuesday for the biggest shakeup in its governing system since the U.S. military occupation, eliminating entire layers of government and giving Prime Minister Haider al-Abadi new powers.  ",News
762,,2015-08-10,article,Your Monday Evening Briefing,55c921cb7988100fc7f12bca,NYTNow,Our nightly rundown will get you caught up on the day’s big stories.,NYT Now,,Your Monday Evening Briefing Our nightly rundown will get you caught up on the day’s big stories.  ,News
763,,2015-08-06,article,Former Argentine President on Trial for Bombing Cover-Up,55c2dc277988107e31ff190b,None,"More than 21 years after a bomb ripped through a Jewish community center in Buenos Aires, ex-President Carlos Menem, a former top judge and several other officials went on trial Thursday for allegedly derailing the investigation into Argentina's worst terrorist attack.",World,Americas,"Former Argentine President on Trial for Bombing Cover-Up More than 21 years after a bomb ripped through a Jewish community center in Buenos Aires, ex-President Carlos Menem, a former top judge and several other officials went on trial Thursday for allegedly derailing the investigation into Argentina's worst terrorist attack.  ",News
764,"Manhattan district attorney's office brings charges of second-degree manslaughter, criminally negligent homicide and reckless endangerment against construction managers Wilmer Cueva and Alfonso Prestia and companies Sky Materials and Harco Construction; says unsafe and illegal conditions at construction site in Manhattan's meatpacking district led to April death of worker Carlos Moncayo; all defendants plead not guilty.",2015-08-06,article,Manslaughter Charges for Construction Managers After Queens Worker Dies in Pit Collapse,55c25ba47988107e31ff17b6,Metro,"Cyrus R. Vance Jr., the Manhattan district attorney, also announced the creation of a task force to help identify and prosecute corruption and fraud in the construction business.",N.Y. / Region,,"Manslaughter Charges for Construction Managers After Queens Worker Dies in Pit Collapse Cyrus R. Vance Jr., the Manhattan district attorney, also announced the creation of a task force to help identify and prosecute corruption and fraud in the construction business. Manhattan district attorney's office brings charges of second-degree manslaughter, criminally negligent homicide and reckless endangerment against construction managers Wilmer Cueva and Alfonso Prestia and companies Sky Materials and Harco Construction; says unsafe and illegal conditions at construction site in Manhattan's meatpacking district led to April death of worker Carlos Moncayo; all defendants plead not guilty.",News
765,,2015-08-03,article,NY School Problems Highlight Debate Over Outside 'Receivers',55bf7cc17988102ce5b0d0e3,None,"The clock is ticking for leaders of New York's most chronically underperforming public schools, who under a new state law must quickly begin to turn things around or lose control to an outsider &#8212; a tactic that has produced mixed results elsewhere.",U.S.,,"NY School Problems Highlight Debate Over Outside 'Receivers' The clock is ticking for leaders of New York's most chronically underperforming public schools, who under a new state law must quickly begin to turn things around or lose control to an outsider &#8212; a tactic that has produced mixed results elsewhere.  ",News
766,"David Brooks Op-Ed column praises speech given by Anand Giridharadas at Aspen Action Forum for pointing to flaws of contemporary capitalism, particularly in the context of income inequality; suggests that big debate about nature of capitalism and its future is underway, as can be seen by way progressives like Hillary Rodham Clinton are pushing for government to become heavily involved in private sector. ",2015-07-31,article,Two Cheers for Capitalism,55bb26ca79881073c9554dbc,OpEd,A big coming debate will be over how much say government should have over business and income equality.,Opinion,,"Two Cheers for Capitalism A big coming debate will be over how much say government should have over business and income equality. David Brooks Op-Ed column praises speech given by Anand Giridharadas at Aspen Action Forum for pointing to flaws of contemporary capitalism, particularly in the context of income inequality; suggests that big debate about nature of capitalism and its future is underway, as can be seen by way progressives like Hillary Rodham Clinton are pushing for government to become heavily involved in private sector. ",Op-Ed
767,,2015-07-30,article,Iraqis Take Mandatory Day Off as Heat Wave Smothers Mideast,55ba12e7798810561813c411,None,"It's a 15-minute walk through a lush palm grove from Baghdad's al-Takia refugee camp to the nearest well, but as temperatures hovered around 52 degrees Celsius (126 F) on Thursday, Zakiyah Abdullah, who is eight months pregnant, said it felt like an eternity.",World,Middle East,"Iraqis Take Mandatory Day Off as Heat Wave Smothers Mideast It's a 15-minute walk through a lush palm grove from Baghdad's al-Takia refugee camp to the nearest well, but as temperatures hovered around 52 degrees Celsius (126 F) on Thursday, Zakiyah Abdullah, who is eight months pregnant, said it felt like an eternity.  ",News
768,,2015-08-09,article,Juvenile Court Decision Due in Slender Man Stabbing Case,55c774807988106f6132e0eb,None,A pivotal decision is due this week in the case of two 13-year-old Wisconsin girls accused of stabbing a classmate to please online horror character Slender Man &#8212; keep them in adult court or move them into the juvenile system.,U.S.,,Juvenile Court Decision Due in Slender Man Stabbing Case A pivotal decision is due this week in the case of two 13-year-old Wisconsin girls accused of stabbing a classmate to please online horror character Slender Man &#8212; keep them in adult court or move them into the juvenile system.  ,News
769,"Op-Ed article by former New York State Assemblyman Nelson A Denis observes that bond payment crisis in Puerto Rico is rooted in United States' decision to 'colonize' island and impose harsh type of capitalism; reviews island's history, noting that its economy has long been exploited by unfair legislation; calls for repeal of Jones Act, which requires every product entering or leaving island to be carried on US ship, and for island to be granted full independence. ",2015-08-06,article,"Free Puerto Rico, America’s Colony",55c30ae47988107e31ff196c,OpEd,The island is broke because of an oppressive economic system.,Opinion,,"Free Puerto Rico, America’s Colony The island is broke because of an oppressive economic system. Op-Ed article by former New York State Assemblyman Nelson A Denis observes that bond payment crisis in Puerto Rico is rooted in United States' decision to 'colonize' island and impose harsh type of capitalism; reviews island's history, noting that its economy has long been exploited by unfair legislation; calls for repeal of Jones Act, which requires every product entering or leaving island to be carried on US ship, and for island to be granted full independence. ",Op-Ed
770,"More spas in New York City are offering soaking baths, steam rooms and other amenities typically found at five-star getaway resorts; Spa Castle Premier 57 charges flat entrance fee of $65 and other treatments are billed as add-ons.",2015-08-06,article,Spas Import an International Menu of Pampering,55c0e43b79881053589a072f,Styles,"The standard massage is getting competition from treatments you might encounter in Germany, Turkey, Korea or Thailand.",Fashion & Style,,"Spas Import an International Menu of Pampering The standard massage is getting competition from treatments you might encounter in Germany, Turkey, Korea or Thailand. More spas in New York City are offering soaking baths, steam rooms and other amenities typically found at five-star getaway resorts; Spa Castle Premier 57 charges flat entrance fee of $65 and other treatments are billed as add-ons.",News
771,,2015-08-05,article,Sister: Man Charged With Killing Officer Claims Self-Defense,55c1ce2479881053589a09a6,None,The sister of an ex-convict charged with fatally shooting a Memphis police officer during a struggle says her brother was just trying to defend himself because the officer was manhandling him and being too aggressive.,U.S.,,Sister: Man Charged With Killing Officer Claims Self-Defense The sister of an ex-convict charged with fatally shooting a Memphis police officer during a struggle says her brother was just trying to defend himself because the officer was manhandling him and being too aggressive.  ,News
772,,2015-08-04,article,Wealthy Conservatives Cap Koch Brothers Weekend With Pledges,55c066e579881038277d8708,None,"One by one, the wealthy conservative donors stood up Monday and pledged millions of dollars to the favorite causes of billionaire industrialists Charles and David Koch.",U.S.,Politics,"Wealthy Conservatives Cap Koch Brothers Weekend With Pledges One by one, the wealthy conservative donors stood up Monday and pledged millions of dollars to the favorite causes of billionaire industrialists Charles and David Koch.  ",News
773,,2015-08-03,article,Senate Blocks Planned Parenthood Defunding Measure,55bef8847988102ce5b0cfbb,None,"Republican legislation to cut off federal funding for Planned Parenthood failed to gather enough support in the U.S. Senate on Monday, halting at least for now moves to punish the women's health group for its role in gathering fetal tissue from abortions for medical research.",U.S.,Politics,"Senate Blocks Planned Parenthood Defunding Measure Republican legislation to cut off federal funding for Planned Parenthood failed to gather enough support in the U.S. Senate on Monday, halting at least for now moves to punish the women's health group for its role in gathering fetal tissue from abortions for medical research.  ",News
774,,2015-08-02,article,"Corrections: August 2, 2015",55bdac367988102a810a4cfd,Summary,"Corrections appearing in print on Sunday, August 2, 2015.",Corrections,,"Corrections: August 2, 2015 Corrections appearing in print on Sunday, August 2, 2015.  ",News
775,,2015-08-07,article,U.S. Republican Contenders' Policy Positions in First Debates,55c43837798810228c90e22b,None,The 17 Republicans running for president squared off in two debates aired on Thursday evening on Fox News. ,U.S.,,U.S. Republican Contenders' Policy Positions in First Debates The 17 Republicans running for president squared off in two debates aired on Thursday evening on Fox News.   ,News
776,,2015-08-06,article,Warming Climate Leaves Alaskans With Fewer Walrus to Hunt,55c2f6337988107e31ff1931,None,Anna Oxereok grew up eating walrus in the western Alaska village of Wales. Today it's such a rare treat she can't bring herself to part with the plastic gallon bag of meat in her freezer.,U.S.,,Warming Climate Leaves Alaskans With Fewer Walrus to Hunt Anna Oxereok grew up eating walrus in the western Alaska village of Wales. Today it's such a rare treat she can't bring herself to part with the plastic gallon bag of meat in her freezer.  ,News
777,,2015-08-03,article,Western Companies Look Hard at China as Growth Slows,55bf07497988102ce5b0cfcf,None,"The Chinese slowdown is forcing many Western companies to take a hard look at their businesses there, leading many to reduce investments, costs and product lines and to tackle increasing bad debts.",Business Day,,"Western Companies Look Hard at China as Growth Slows The Chinese slowdown is forcing many Western companies to take a hard look at their businesses there, leading many to reduce investments, costs and product lines and to tackle increasing bad debts.  ",News
778,"Paul Krugman Op-Ed column suggests fluctuations in Chinese stock market shows Chinese leaders have no idea what they are doing with respect to economy, despite its 25 years of success; points to efforts to prop up stock prices, and blaming of stock plunge on foreign conspiracy, as evidence that country's leaders do not have economic acumen with which they were once credited.",2015-07-31,article,China’s Naked Emperors,55bb26c779881073c9554dba,OpEd,"The politicians in Beijing who have ruled during economic booms, not unlike many of their American counterparts, have no idea what they’re doing.",Opinion,,"China’s Naked Emperors The politicians in Beijing who have ruled during economic booms, not unlike many of their American counterparts, have no idea what they’re doing. Paul Krugman Op-Ed column suggests fluctuations in Chinese stock market shows Chinese leaders have no idea what they are doing with respect to economy, despite its 25 years of success; points to efforts to prop up stock prices, and blaming of stock plunge on foreign conspiracy, as evidence that country's leaders do not have economic acumen with which they were once credited.",Op-Ed
779,,2015-07-29,article,Obamacare Case to Be Turned Against Government on Emissions Rule,55b8604d7988103b2266cc75,None,Opponents of President Barack Obama's soon-to-be-implemented policy to cut carbon emissions from power plants are planning to use an unlikely and potentially potent weapon against him: the recent U.S. Supreme Court decision that saved Obamacare.,U.S.,Politics,Obamacare Case to Be Turned Against Government on Emissions Rule Opponents of President Barack Obama's soon-to-be-implemented policy to cut carbon emissions from power plants are planning to use an unlikely and potentially potent weapon against him: the recent U.S. Supreme Court decision that saved Obamacare.  ,News
780,"National Transportation Safety Board concludes that Virgin Galactic space plane crashed in Mojave Desert during October 2014 test flight because co-pilot Michael Alsbury prematurely unlocked mechanism for its descent; pilot Peter Siebold survived crash, but Alsbury died.",2015-07-29,article,Virgin Galactic SpaceShipTwo Crash Traced to Co-Pilot Error,55b7f3417988103b2266cb8f,National,Federal investigators said the manufacturer failed to consider that a pilot might prematurely unlock a mechanism for the space plane’s descent.,Science,Space & Cosmos,"Virgin Galactic SpaceShipTwo Crash Traced to Co-Pilot Error Federal investigators said the manufacturer failed to consider that a pilot might prematurely unlock a mechanism for the space plane’s descent. National Transportation Safety Board concludes that Virgin Galactic space plane crashed in Mojave Desert during October 2014 test flight because co-pilot Michael Alsbury prematurely unlocked mechanism for its descent; pilot Peter Siebold survived crash, but Alsbury died.",News
781,"William C Rhoden Sports of The Times column calls on Pro Football Hall of Fame to allow former linebacker Junior Seau's daughter Sydney to speak about him at induction ceremony; postulates that Hall of Fame is not forbidding speech as simple matter of policy, but out of fear that she might mention brain disease her father suffered that was likely caused by head traumas sustained in his job.",2015-07-29,article,Cloud Hangs Over Hall of Fame Farewell to Junior Seau,55b7b52a7988103b2266caba,Sports,Allowing Seau’s daughter Sydney to bid a proper farewell to her dad before his N.F.L. family is an easy fix if the Pro Football Hall of Fame allows common sense to be its guide.,Sports,Pro Football,"Cloud Hangs Over Hall of Fame Farewell to Junior Seau Allowing Seau’s daughter Sydney to bid a proper farewell to her dad before his N.F.L. family is an easy fix if the Pro Football Hall of Fame allows common sense to be its guide. William C Rhoden Sports of The Times column calls on Pro Football Hall of Fame to allow former linebacker Junior Seau's daughter Sydney to speak about him at induction ceremony; postulates that Hall of Fame is not forbidding speech as simple matter of policy, but out of fear that she might mention brain disease her father suffered that was likely caused by head traumas sustained in his job.",News
782,,2015-07-28,article,"Merck Tops Street 2Q Forecasts Despite Lower Sales, Profit",55b766b57988101c94458fe8,None,"Merck &amp; Co.'s second-quarter profit plunged by two-thirds, hammered by the sale of its consumer business, unfavorable currency exchange rates, lower sales of some key drugs and hefty one-time charges.",Business Day,,"Merck Tops Street 2Q Forecasts Despite Lower Sales, Profit Merck &amp; Co.'s second-quarter profit plunged by two-thirds, hammered by the sale of its consumer business, unfavorable currency exchange rates, lower sales of some key drugs and hefty one-time charges.  ",News
783,,2015-07-28,article,"As Fed Approaches Rate Hike, Job Growth Shifts Away From Oil Patch",55b7465a7988101c94458f9e,None,"The rebound in U.S. jobs, limited in the early part of the recovery to a handful of booming industries such as oil, has broadened across the country as old-line industrial areas such as Michigan and sun belt hubs like Florida pick up the slack.",Business Day,,"As Fed Approaches Rate Hike, Job Growth Shifts Away From Oil Patch The rebound in U.S. jobs, limited in the early part of the recovery to a handful of booming industries such as oil, has broadened across the country as old-line industrial areas such as Michigan and sun belt hubs like Florida pick up the slack.  ",News
784,,2015-08-10,article,Novavax: Early Study Indicates Its Vaccine Effective vs. RSV,55c905887988100fc7f12b7a,None,"Early research in older adults found an experimental vaccine prevented nearly two-thirds of serious cases of a common, seasonal respiratory virus that annually kills thousands of vulnerable Americans &#8212; babies and senior citizens.",U.S.,,"Novavax: Early Study Indicates Its Vaccine Effective vs. RSV Early research in older adults found an experimental vaccine prevented nearly two-thirds of serious cases of a common, seasonal respiratory virus that annually kills thousands of vulnerable Americans &#8212; babies and senior citizens.  ",News
785,,2015-08-09,article,Mysterious Fungus Killing Snakes In at Least 9 States,55c7671f7988106f6132e0de,None,"Hidden on hillsides in a remote part of western Vermont, a small number of venomous timber rattlesnakes slither among the rocks, but their isolation can't protect them from a mysterious fungus spreading across the eastern half of the country that threatens to wipe them out.",U.S.,,"Mysterious Fungus Killing Snakes In at Least 9 States Hidden on hillsides in a remote part of western Vermont, a small number of venomous timber rattlesnakes slither among the rocks, but their isolation can't protect them from a mysterious fungus spreading across the eastern half of the country that threatens to wipe them out.  ",News
786,,2015-08-08,article,Candidates Continue to Plead Their Cases After First Republican Debate,55c50c2b7988104f5eefc1f4,National,"Some White House hopefuls, including Donald J. Trump and Senator Marco Rubio, worked to explain themselves — and comments they had made — after Thursday’s debate.",U.S.,Politics,"Candidates Continue to Plead Their Cases After First Republican Debate Some White House hopefuls, including Donald J. Trump and Senator Marco Rubio, worked to explain themselves — and comments they had made — after Thursday’s debate.  ",News
787,,2015-08-07,article,Your Friday Evening Briefing,55c527c17988104f5eefc265,NYTNow,Our nightly rundown will get you caught up on the day’s big stories.,NYT Now,,Your Friday Evening Briefing Our nightly rundown will get you caught up on the day’s big stories.  ,News
788,,2015-08-05,article,Family of Man Shot Dead by Police on Skid Row Files Lawsuit,55c235907988107e31ff1728,None,"The family of a homeless man killed by Los Angeles police on Skid Row sued the city and police department Wednesday, contesting officers' claim that the man reached for one of their guns and calling it ""a classic case of abuse of power and deadly force.""",U.S.,,"Family of Man Shot Dead by Police on Skid Row Files Lawsuit The family of a homeless man killed by Los Angeles police on Skid Row sued the city and police department Wednesday, contesting officers' claim that the man reached for one of their guns and calling it ""a classic case of abuse of power and deadly force.""  ",News
789,,2015-08-04,article,US Stocks Move Lower as Earnings Disappoint; Allstate Slumps,55c0532879881038277d86df,None,U.S. stocks fell for a third straight day Tuesday as investors assessed some disappointing earnings reports.,World,Asia Pacific,US Stocks Move Lower as Earnings Disappoint; Allstate Slumps U.S. stocks fell for a third straight day Tuesday as investors assessed some disappointing earnings reports.  ,News
790,,2015-08-04,article,Your Tuesday Evening Briefing,55c1348579881053589a0850,NYTNow,Our nightly rundown will get you caught up on the day’s big stories.,NYT Now,,Your Tuesday Evening Briefing Our nightly rundown will get you caught up on the day’s big stories.  ,News
791,,2015-07-31,article,Angry Bent of Party Let Trump Rise,55bb5dc479881073c9554e6a,Foreign,"Donald Trump infuriates mainstream Republicans, but party leaders bear some responsibility for his ascent.",U.S.,Politics,"Angry Bent of Party Let Trump Rise Donald Trump infuriates mainstream Republicans, but party leaders bear some responsibility for his ascent.  ",News
