,abstract,date,doctype,headline,id,news_desk,paragraph,section,subsection,text,type
0,A study raises questions about the effectiveness of the body mass index letters that the state started sending home more than a decade ago.,2015-08-10,blogpost,&#8216;Body&#8217; Report Cards Aren&#8217;t Influencing Arkansas Teenagers,55c873ce7988107a9cc5c737,Science,,Health,,&#8216;Body&#8217; Report Cards Aren&#8217;t Influencing Arkansas Teenagers   A study raises questions about the effectiveness of the body mass index letters that the state started sending home more than a decade ago.,Blog
1,"World Health Organization reports Guinea and Sierra Leone have had seven new Ebola cases in past week, lowest weekly total of new infections in over a year; cautions that there is still substantial risk of outbreaks due to thousands who were exposed in region.",2015-07-30,article,"New Ebola Cases Decline, but W.H.O. Advises Caution",55b96bd6798810561813c273,Foreign,"Seven new cases of Ebola were reported in Guinea and Sierra Leone last week, the lowest weekly total in more than a year.",World,Africa,"New Ebola Cases Decline, but W.H.O. Advises Caution Seven new cases of Ebola were reported in Guinea and Sierra Leone last week, the lowest weekly total in more than a year. World Health Organization reports Guinea and Sierra Leone have had seven new Ebola cases in past week, lowest weekly total of new infections in over a year; cautions that there is still substantial risk of outbreaks due to thousands who were exposed in region.",Brief
2,"Occupational Safety and Health Admin unveils stricter standards for workplace exposure to beryllium, common industrial metal that has been linked to a deadly lung disease; experts welcome news but say decades-long delay in passing measure has exacted heavy human toll. ",2015-08-07,article,OSHA to Propose Beryllium Limit in the Works Since 1975,55c2c5aa7988107e31ff18d2,Business,"The allowable level of workplace exposure to beryllium would be sharply curtailed, to one-tenth the amount that is currently permissible.",Business Day,,"OSHA to Propose Beryllium Limit in the Works Since 1975 The allowable level of workplace exposure to beryllium would be sharply curtailed, to one-tenth the amount that is currently permissible. Occupational Safety and Health Admin unveils stricter standards for workplace exposure to beryllium, common industrial metal that has been linked to a deadly lung disease; experts welcome news but say decades-long delay in passing measure has exacted heavy human toll. ",News
3,"Infections from new strain of meningitis are on rise in Africa, prompting concern about potential epidemic; some experts have called on drug manufacturers to step up production of vaccines, which are expensive and in short supply.",2015-08-01,article,New Meningitis Strain in Africa Brings Call for More Vaccines,55bc212f79881012a690ae98,Foreign,An international consortium is seeking five million doses of the vaccine against Type C meningitis and says they must arrive by January to be effective.,Health,,"New Meningitis Strain in Africa Brings Call for More Vaccines An international consortium is seeking five million doses of the vaccine against Type C meningitis and says they must arrive by January to be effective. Infections from new strain of meningitis are on rise in Africa, prompting concern about potential epidemic; some experts have called on drug manufacturers to step up production of vaccines, which are expensive and in short supply.",News
4,Adam Bryant Corner Office column features interview with Catholic Health Initiatives CEO Kevin E Lofton.,2015-08-09,article,Kevin E. Lofton of Catholic Health Initiatives: Designate a Devil’s Advocate,55c621da7988104f5eefc3d8,SundayBusiness,The chief executive of the health care organization recommends choosing a person to take a contrasting viewpoint to avoid groupthink during meetings.,Business Day,,Kevin E. Lofton of Catholic Health Initiatives: Designate a Devil’s Advocate The chief executive of the health care organization recommends choosing a person to take a contrasting viewpoint to avoid groupthink during meetings. Adam Bryant Corner Office column features interview with Catholic Health Initiatives CEO Kevin E Lofton.,Question
5,"World Health Organization reports that Sierra Leone and Guinea have each logged only one new Ebola case in over a year; says there are no new cases in Liberia, third nation most severely affected by outbreak; data offers hope that epidemic could be quelled by end of 2015.",2015-08-05,article,"Ebola Cases Fall Sharply, W.H.O. Reports",55c1474079881053589a088e,Foreign,"The number of new Ebola diagnoses in Sierra Leone and Guinea reached its lowest point in well over a year last week, according to the World Health Organization.",World,Africa,"Ebola Cases Fall Sharply, W.H.O. Reports The number of new Ebola diagnoses in Sierra Leone and Guinea reached its lowest point in well over a year last week, according to the World Health Organization. World Health Organization reports that Sierra Leone and Guinea have each logged only one new Ebola case in over a year; says there are no new cases in Liberia, third nation most severely affected by outbreak; data offers hope that epidemic could be quelled by end of 2015.",News
6,"More than 70,000 births during Ebola crisis in Liberia were never recorded, leaving them vulnerable to marginalization as noncitizens, denial of government services, trafficking and illegal adoption.",2015-07-31,article,Liberia: Ebola Stalls Birth Registrations,55bac26a79881073c9554cfd,Foreign,"The births of more than 70,000 children in Liberia during the Ebola crisis were never recorded, leaving them vulnerable to marginalization.",World,Africa,"Liberia: Ebola Stalls Birth Registrations The births of more than 70,000 children in Liberia during the Ebola crisis were never recorded, leaving them vulnerable to marginalization. More than 70,000 births during Ebola crisis in Liberia were never recorded, leaving them vulnerable to marginalization as noncitizens, denial of government services, trafficking and illegal adoption.",Brief
7,"New York City Health Commissioner Dr Mary T Bassett, in response to Legionnaires' disease outbreak that has killed 10 people in city, orders all buildings with water cooling towers to inspect and disinfect units within two weeks; some experts say order is unrealistic in scope; Mayor Bill de Blasio is set to unveil legislative plan to tighten regulation on such towers.",2015-08-07,article,New York Ordering Tests of Water-Cooling Towers Amid Legionnaires’ Outbreak,55c3bddf798810228c90e0e7,Metro,"Mayor Bill de Blasio of New York said building owners had two weeks to test and disinfect the towers, as the death toll from the disease rose to 10.",N.Y. / Region,,"New York Ordering Tests of Water-Cooling Towers Amid Legionnaires’ Outbreak Mayor Bill de Blasio of New York said building owners had two weeks to test and disinfect the towers, as the death toll from the disease rose to 10. New York City Health Commissioner Dr Mary T Bassett, in response to Legionnaires' disease outbreak that has killed 10 people in city, orders all buildings with water cooling towers to inspect and disinfect units within two weeks; some experts say order is unrealistic in scope; Mayor Bill de Blasio is set to unveil legislative plan to tighten regulation on such towers.",News
8,"More than 13,000 West Africans who survived Ebola outbreak now face lingering and disabling health problems, ranging from joint pain to depression and post-traumatic stress disorder. ",2015-08-08,article,"Ebola Survivors Face Lingering Pain, Fatigue and Depression",55c51cc77988104f5eefc238,Foreign,"About half the survivors seem to have chronic joint pain that is often severe enough to prevent them from working, an expert said.",World,Africa,"Ebola Survivors Face Lingering Pain, Fatigue and Depression About half the survivors seem to have chronic joint pain that is often severe enough to prevent them from working, an expert said. More than 13,000 West Africans who survived Ebola outbreak now face lingering and disabling health problems, ranging from joint pain to depression and post-traumatic stress disorder. ",News
9,"Health and Human Services Dept reports that many consumers are benefiting from competition among insurers under Affordable Care Act, which has created greater choice in marketplace; findings are based on study of 35 states.  ",2015-07-31,article,"Increased Competition Kept Lid on Health Insurance Inflation, U.S. Says",55ba907879881073c9554c5d,National,The Obama administration said on Thursday that many consumers were benefiting from increased competition among insurers under the Affordable Care Act.,U.S.,,"Increased Competition Kept Lid on Health Insurance Inflation, U.S. Says The Obama administration said on Thursday that many consumers were benefiting from increased competition among insurers under the Affordable Care Act. Health and Human Services Dept reports that many consumers are benefiting from competition among insurers under Affordable Care Act, which has created greater choice in marketplace; findings are based on study of 35 states.  ",News
10,"Louis Sokoloff, scientists who was instrumental in developing PET scan technique for measuring human brain function, dies at age 93.",2015-08-06,article,"Louis Sokoloff, Pioneer of PET Scan, Dies at 93",55c2c0f07988107e31ff18cc,National,Dr. Sokoloff won the Albert Lasker Clinical Medical Research Award in 1981 for his role in developing the vivid color images that map brain function.,Science,,"Louis Sokoloff, Pioneer of PET Scan, Dies at 93 Dr. Sokoloff won the Albert Lasker Clinical Medical Research Award in 1981 for his role in developing the vivid color images that map brain function. Louis Sokoloff, scientists who was instrumental in developing PET scan technique for measuring human brain function, dies at age 93.",Obituary
11,World Health Organization and other international aid agencies suspend 84 percent of their health programs in 10 Iraqi provinces due to gap in donations; says shortfall deprives basic health care for nearly three million people.,2015-08-05,article,Iraq: Funding Shortfall Deprives Uprooted Iraqis of Health Services,55c1614079881053589a08b3,Foreign,"The aid agencies, including the W.H.O., need $60.9 million to operate their health care centers in Iraq but have received only $5.1 million from donors.",World,Middle East,"Iraq: Funding Shortfall Deprives Uprooted Iraqis of Health Services The aid agencies, including the W.H.O., need $60.9 million to operate their health care centers in Iraq but have received only $5.1 million from donors. World Health Organization and other international aid agencies suspend 84 percent of their health programs in 10 Iraqi provinces due to gap in donations; says shortfall deprives basic health care for nearly three million people.",Brief
12,"New York City and State officials clash over response to outbreak of Legionnaires' disease in South Bronx that has killed 101 people, even as disease shows signs of ebbing.",2015-08-08,article,Officials in Turf Fight Over Response to Legionnaires’ Outbreak in Bronx,55c4ed187988104f5eefc184,Metro,New York officials jockeyed for position as the outbreak appeared to be ebbing.,N.Y. / Region,,"Officials in Turf Fight Over Response to Legionnaires’ Outbreak in Bronx New York officials jockeyed for position as the outbreak appeared to be ebbing. New York City and State officials clash over response to outbreak of Legionnaires' disease in South Bronx that has killed 101 people, even as disease shows signs of ebbing.",News
13,"Fourth victim dies in South Bronx of Legionnaires' disease, making outbreak worst New York City has experienced in last three years; death reinforces worries that city is unprepared to combat the airborne illness. ",2015-08-02,article,Bronx Residents Anxious After 4th Death From Legionnaires’ Disease,55bd2de27988102a810a4c5f,Metro,"As the number of cases climbed to 65, city officials said tests revealed the outsides of five building were contaminated.",N.Y. / Region,,"Bronx Residents Anxious After 4th Death From Legionnaires’ Disease As the number of cases climbed to 65, city officials said tests revealed the outsides of five building were contaminated. Fourth victim dies in South Bronx of Legionnaires' disease, making outbreak worst New York City has experienced in last three years; death reinforces worries that city is unprepared to combat the airborne illness. ",News
14,"At least 31 people in South Bronx are stricken with Legionnaires' Disease, which is commonly spread via water mist, and two people die; several apartment building cooling towers in area are found to contain bacteria.",2015-07-30,article,"Legionnaires’ Disease Sickens 31, 2 Fatally, in the South Bronx",55b98b09798810561813c2a2,Metro,"The outbreak of the disease, the largest New York City has seen in at least two years, has flared up in the neighborhoods of Highbridge, Morrisania, Mott Haven and Hunts Point since July 10.",N.Y. / Region,,"Legionnaires’ Disease Sickens 31, 2 Fatally, in the South Bronx The outbreak of the disease, the largest New York City has seen in at least two years, has flared up in the neighborhoods of Highbridge, Morrisania, Mott Haven and Hunts Point since July 10. At least 31 people in South Bronx are stricken with Legionnaires' Disease, which is commonly spread via water mist, and two people die; several apartment building cooling towers in area are found to contain bacteria.",News
15,"New York City health officials confirm third death of Bronx resident due to Legionnaire's disease; at least 57 people in city have become ill with disease, likely due to use of air-conditioning systems, which help spread legionella bacteria.",2015-08-01,article,Third Person Dies of Legionnaires’ Disease in the Bronx,55bc1fb279881012a690ae95,Metro,"The death is part of an outbreak of the airborne illness that has infected at least 57 people in recent weeks in the borough, New York City officials said.",N.Y. / Region,,"Third Person Dies of Legionnaires’ Disease in the Bronx The death is part of an outbreak of the airborne illness that has infected at least 57 people in recent weeks in the borough, New York City officials said. New York City health officials confirm third death of Bronx resident due to Legionnaire's disease; at least 57 people in city have become ill with disease, likely due to use of air-conditioning systems, which help spread legionella bacteria.",News
16,"Richard S Schweiker, former United States representative and senator from Pennsylvania who served as secretary of health and human services under Pres Ronald Reagan, dies at age 89.  ",2015-08-04,article,"Richard S. Schweiker, Former Senator and Reagan Confidant, Dies at 89",55bff67079881038277d8638,National,"Mr. Schweiker, a Pennsylvania Republican, served for two decades in Congress and two more years in the White House in an era of assassinations, war and sweeping social changes.",U.S.,,"Richard S. Schweiker, Former Senator and Reagan Confidant, Dies at 89 Mr. Schweiker, a Pennsylvania Republican, served for two decades in Congress and two more years in the White House in an era of assassinations, war and sweeping social changes. Richard S Schweiker, former United States representative and senator from Pennsylvania who served as secretary of health and human services under Pres Ronald Reagan, dies at age 89.  ",Obituary
17,Test your knowledge of this week’s health news.,2015-08-07,blogpost,"The Weekly Health Quiz: Spicy Food, Running Shoes and Legionnaire&rsquo;s Disease",55c4ae7b798810228c90e341,Science,,Health,,"The Weekly Health Quiz: Spicy Food, Running Shoes and Legionnaire&rsquo;s Disease   Test your knowledge of this week’s health news.",Blog
18,,2015-08-02,multimedia,Dan Buettner’s Longevity Feast,55ca1b277988100fc7f12e25,Fashion & Style,Can the insights of a longevity specialist be applied to the life of a food-obsessed writer in New York City?,Fashion & Style,,Dan Buettner’s Longevity Feast Can the insights of a longevity specialist be applied to the life of a food-obsessed writer in New York City?  ,Slideshow
19,"New York State Health Dept announces names of five organizations that will be allowed to grow and sell marijuana for medical use, each of which plans to open four dispensaries across the state, including in New York City; authorization to sell stems from law signed by Gov Andrew M Cuomo in 2014; companies can only sell drug that is made in-state.",2015-08-01,article,New York State Awards 5 Medical Marijuana Licenses,55bba01179881012a690acf5,Metro,"The companies are required to be doing business within six months, meaning medical marijuana could be on sale in New York before the end of the year.",N.Y. / Region,,"New York State Awards 5 Medical Marijuana Licenses The companies are required to be doing business within six months, meaning medical marijuana could be on sale in New York before the end of the year. New York State Health Dept announces names of five organizations that will be allowed to grow and sell marijuana for medical use, each of which plans to open four dispensaries across the state, including in New York City; authorization to sell stems from law signed by Gov Andrew M Cuomo in 2014; companies can only sell drug that is made in-state.",News
20,"Editorial welcomes reports from Kaiser Family Foundation and Covered California finding that two-thirds of California's previously uninsured residents have gained coverage under the Affordable Care Act, and that average premiums in state are likely to rise only 4 percent in 2016.  ",2015-08-10,article,California Is Proving That Health Reform Works,55c851387988107a9cc5c6f1,Editorial,"In a double dose of good news, more of the state’s uninsured gained coverage and premiums have risen only modestly.",Opinion,,"California Is Proving That Health Reform Works In a double dose of good news, more of the state’s uninsured gained coverage and premiums have risen only modestly. Editorial welcomes reports from Kaiser Family Foundation and Covered California finding that two-thirds of California's previously uninsured residents have gained coverage under the Affordable Care Act, and that average premiums in state are likely to rise only 4 percent in 2016.  ",Editorial
21,,2015-08-06,multimedia,Health fears at France migrant camp,55c32c2a7988107e31ff19c9,Multimedia/Photos,A medical charity warns of growing health problems among migrants camping out at Calais hoping to reach Britain. Paul Chapman reports.,Multimedia/Photos,,Health fears at France migrant camp A medical charity warns of growing health problems among migrants camping out at Calais hoping to reach Britain. Paul Chapman reports.  ,Video
22,"Even if Medicare pays for end-of-life discussions, most doctors don’t know how to handle them. Videos can facilitate the conversation.",2015-07-29,blogpost,Building a Khan Academy for Health Care,55b8af0b7988103b2266cd59,OpEd,,Opinion,,"Building a Khan Academy for Health Care   Even if Medicare pays for end-of-life discussions, most doctors don’t know how to handle them. Videos can facilitate the conversation.",Blog
23,,2015-08-05,multimedia,Jeb Bush on Funding for Women’s Health,55c21ce279881053589a0a9e,U.S. / Politics,"Jeb Bush, the Republican presidential candidate, said on Tuesday that he would cut off federal funding for Planned Parenthood if elected to the White House.",U.S.,Politics,"Jeb Bush on Funding for Women’s Health Jeb Bush, the Republican presidential candidate, said on Tuesday that he would cut off federal funding for Planned Parenthood if elected to the White House.  ",Video
24,"New York City Mayor Bill de Blasio introduces NYC Safe, $22 million initiative aimed at identifying and treating mentally ill people with violent behavior; says that although plan has been portrayed as program for homeless, it is actually part of larger plan to address and destigmatize mental illness; various city agencies will share information about such people in effort to better serve them and address community safety concerns. ",2015-08-07,article,New York City Initiative Aims to Help Mentally Ill People Who Get Violent,55c410e3798810228c90e1d1,Metro,"The $22 million NYC Safe program will work toward increasing security at homeless shelters and treating people prone to hurting themselves or others, relying on interagency cooperation.",N.Y. / Region,,"New York City Initiative Aims to Help Mentally Ill People Who Get Violent The $22 million NYC Safe program will work toward increasing security at homeless shelters and treating people prone to hurting themselves or others, relying on interagency cooperation. New York City Mayor Bill de Blasio introduces NYC Safe, $22 million initiative aimed at identifying and treating mentally ill people with violent behavior; says that although plan has been portrayed as program for homeless, it is actually part of larger plan to address and destigmatize mental illness; various city agencies will share information about such people in effort to better serve them and address community safety concerns. ",News
25,Report in medical journal The Lancet finds that experimental vaccine being tested on people who have been exposed to Ebola virus in Guinea appears to be safe and 75 to 100 percent effective.,2015-08-01,article,"Experimental Ebola Vaccine Tested in Guinea Shows Promise, Report Says",55bb634879881073c9554e77,Foreign,"The report, published in the British medical journal The Lancet, indicated that the vaccine “might be safe and highly efficacious in preventing Ebola virus disease.”",World,Africa,"Experimental Ebola Vaccine Tested in Guinea Shows Promise, Report Says The report, published in the British medical journal The Lancet, indicated that the vaccine “might be safe and highly efficacious in preventing Ebola virus disease.” Report in medical journal The Lancet finds that experimental vaccine being tested on people who have been exposed to Ebola virus in Guinea appears to be safe and 75 to 100 percent effective.",News
26,,2015-08-07,multimedia,"Boxing’s Faces, Old and New",55ca1c59798810348576cabc,Fashion & Style / Men’s Style,"The sport is drawing a fresh wave of gymgoers hungry for a serious, old-school workout, save for the body blows.",Fashion & Style,Men’s Style,"Boxing’s Faces, Old and New The sport is drawing a fresh wave of gymgoers hungry for a serious, old-school workout, save for the body blows.  ",Slideshow
27,Test your knowledge of this week’s health news.,2015-07-31,blogpost,"The Weekly Health Quiz: Getting Fit, a Banned Drug and Girls vs. Boys",55bb7f4c79881073c9554ed8,Science,,Health,,"The Weekly Health Quiz: Getting Fit, a Banned Drug and Girls vs. Boys   Test your knowledge of this week’s health news.",Blog
28,Surging popularity of boxing for fitness and stress relief leads to proliferation of new gyms and programs dedicated to sport.  ,2015-08-07,article,The New Workout: Boxing Without the Bruises,55c3686e7988107e31ff1a56,Styles,"Two new gyms in Manhattan offer boxing as a novel, noncontact workout, and even at Brooklyn’s old-school Gleason’s Gym, most people never take a punch.",Fashion & Style,Men’s Style,"The New Workout: Boxing Without the Bruises Two new gyms in Manhattan offer boxing as a novel, noncontact workout, and even at Brooklyn’s old-school Gleason’s Gym, most people never take a punch. Surging popularity of boxing for fitness and stress relief leads to proliferation of new gyms and programs dedicated to sport.  ",News
29,"When cancer patients need help, they are often surprised to find that long-trusted friends have disappeared.",2015-08-06,blogpost,Living With Cancer: Alone and Ghosted,55c3ca25798810228c90e109,Science,,Health,,"Living With Cancer: Alone and Ghosted   When cancer patients need help, they are often surprised to find that long-trusted friends have disappeared.",Blog
30,,2015-07-28,article,"Health Care Spending to Accelerate, US Report Says",55b7e0757988103b2266cb52,None,The nation's respite from accelerating health care costs appears to be over.,U.S.,Politics,"Health Care Spending to Accelerate, US Report Says The nation's respite from accelerating health care costs appears to be over.  ",News
31,Cerner Corp wins multimillion-dollar Defense Dept contract to digitize health records of more than 9.5 million military personnel and beneficiaries.,2015-07-30,article,Cerner Wins Bid to Redo Health Data,55b96f24798810561813c279,Business,"The contract aims to let the Defense Department and the Veterans Affairs Department electronically transmit records to each other, a function they currently cannot do.",Business Day,,"Cerner Wins Bid to Redo Health Data The contract aims to let the Defense Department and the Veterans Affairs Department electronically transmit records to each other, a function they currently cannot do. Cerner Corp wins multimillion-dollar Defense Dept contract to digitize health records of more than 9.5 million military personnel and beneficiaries.",News
32,,2015-08-07,article,"US Hiring in Retail, Health, Professional Services Is Solid",55c4ea1b7988104f5eefc178,None,"U.S. employers across a wide swath of the economy were confident enough in July to hire workers, with nearly every industry sector adding jobs at a solid rate.",U.S.,Politics,"US Hiring in Retail, Health, Professional Services Is Solid U.S. employers across a wide swath of the economy were confident enough in July to hire workers, with nearly every industry sector adding jobs at a solid rate.  ",News
